247506521175498753,2012-09-17 01:25:27,"Sunday again :D, about to play #Borderlands with @Eddie_Ruckus &amp; @21wolv. Being streamed here, come chill with us: http://t.co/H93S4koe"
247495038580424704,2012-09-17 00:39:50,@21wolv @Eddie_Ruckus whenever you're ready :)
247424729332457472,2012-09-16 20:00:27,"@generikb I really enjoyed it, you should, check it out if you haven’t already :)"
247334213647495168,2012-09-16 14:00:46,"@Leonick91 @ftlgame Yes, similar to Humble Bundles (they sell their game through the Humble Bundle store/site)"
247331521885777920,2012-09-16 13:50:04,".@FTLGame is ridiculously addicting w/ awesome soundtrack, worth $10+: http://t.co/X6F8SZMN (Get DRM free + Steam key), rogue-like spacesim"
247054122866585601,2012-09-15 19:27:47,"RT @SethBling: It's here! Team Fortress 2 in Minecraft, no mods/plugins required! http://t.co/nPbWkZNZ"
246950749962108928,2012-09-15 12:37:01,"@Dorkerific @21wolv @Eddie_Ruckus Sunday should be good for me, we’re in my favourite area too :D, can’t wait!"
246641226810540032,2012-09-14 16:07:05,RT @mollstam: Of course there will be capes for everyone going to MINECON!
246641210834427904,2012-09-14 16:07:01,RT @pgeuder: Minecon tickets are moving really fast. 1600 sold and they haven't been available for even an hour. #minecon2012
246637330826412032,2012-09-14 15:51:36,RT @carlmanneh: MINECON tickets sales are now open http://t.co/OOuiOgrC
246482428070359041,2012-09-14 05:36:04,RT @mollstam: I just started the clock for MineCon ticket release — 9h 53m 42s to go!
246374937248542722,2012-09-13 22:28:57,@Eddie_Ruckus @Dorkerific Borderlands today? :) @21wolv is in!
246287909236391936,2012-09-13 16:43:08,Heads up! The #Minecraft Pocket Edition Bug Tracker will be undergoing maintenance on Sat for 2hrs within a Midnight to Noon CEST window
246280441689153536,2012-09-13 16:13:27,RT @mollstam: MineCon ticket sales will go up some time this friday. More info (and countdown!) coming laters…
246075267301400579,2012-09-13 02:38:10,"@Marc_IRL cool, what’d you decide on?"
245936330222223361,2012-09-12 17:26:05,RT @Kappische: Preview of Next Minecraft Xbox Update! http://t.co/KOs0IXri
245363470403530753,2012-09-11 03:29:44,Been really tired and not 100% for the past week or so. Going to try this thing normal people do called sleeping at a decent hour. So odd.
245208289867087873,2012-09-10 17:13:06,"@jythri Thanks! Hope we didn't delay Borderlands 2 too much ;)! Love Borderlands so much, you guys are awesome too!"
245191991388958720,2012-09-10 16:08:20,@jythri also need to wait until the 25th+ as I ordered the Deluxe Vault Hunter edition of #Borderlands2 and need to wait for it to arrive!
245191583702609921,2012-09-10 16:06:43,"@jythri yep, can’t wait! Tried playing it at #PAX Prime but lines were really long+was busy with our @MojangTeam booth :("
245175395492716544,2012-09-10 15:02:24,"Oh my god, this is awesome! @Dinnerbone probably already has one… #DrWho http://t.co/MGiGFUx2"
244925343746625536,2012-09-09 22:28:47,"Are we playing #Borderlands today @Eddie_Ruckus, @Dorkerific? CC: @21wolv"
244227553664045057,2012-09-08 00:16:00,"@iKasperr I'm sure @TrinitroToluene would like that, but I don't think @CristinaRTC would..."
244113727115386880,2012-09-07 16:43:42,RT @MojangTeam: Ooooo a @Threadless and Minecraft mashup of epic proportions!!! http://t.co/6OCfzUM9
243718513766850560,2012-09-06 14:33:16,RT @pgeuder: OMG we've passed 40 Million registered users on http://t.co/zk1ICY9x! (paying: 7.3m )http://t.co/9ca9cjnE
243708585694093313,2012-09-06 13:53:49,"Yes!  Just launched the #Minecraft Pocket Edition bug tracker powered by @JIRA, kindly provided to us by @Atlassian. Seems to be going well!"
243697358070743040,2012-09-06 13:09:12,"RT @jbernhardsson: Minecraft Pocket Edition bug tracker is now up, please only report bugs from 0.4.0 and forwards: https://t.co/oG9yQb4R"
243692012929417218,2012-09-06 12:47:58,RT @jeb_: Minecraft snapshot 12w36a: http://t.co/ldGEnkn7
243661913035243520,2012-09-06 10:48:21,RT @Kappische: Minecraft — Pocket Edition 0.4.0 is OUT! http://t.co/YhjRihnf
243649521677115392,2012-09-06 09:59:07,"Launching the #Minecraft Pocket Edition bug tracker I've been working on, powered by @Atlassian's @JIRA, sometime soon. So excited!"
243630731237138432,2012-09-06 08:44:27,"@RikaiLP used to use that, it kept breaking... and I also need to manage more than one twitter account"
243627771622998016,2012-09-06 08:32:41,@jeb_ @Tweetdeck @Janetter_jp I love Janetter!
243627627733213184,2012-09-06 08:32:07,"RT @jeb_: 12w36a will come later today. Contains a new mob variant, a new block, a new useful item, updated beacon and minor changes to  ..."
243538948129959936,2012-09-06 02:39:44,"@ColeyGhost not sure, my driver's license says 5' 9"", I think (it says 180cm, but I don't think that's right)"
243475446350639104,2012-09-05 22:27:24,"She gave me a Chicken pin, @Dinnerbone a Diamond pickaxe pin and @_grum a Creeper pin :) #Minecraft #PAX"
243474919692853248,2012-09-05 22:25:19,So... we decided to put them on our top hats because they were so awesome (Courtesy @Jungalist81): http://t.co/27wVEJ8p #PAX
243474797928013824,2012-09-05 22:24:50,"After we had our #Minecraft panel at #PAX, a cute little girl walked up to us and gave us these adorable pin creations..."
243473594229866497,2012-09-05 22:20:03,Missed our #Minecraft panel at #PAX? The Minecraft Forums has put together a YouTube highlight of it here: http://t.co/Hr10UTV1
243192913285222401,2012-09-05 03:44:43,"Thanks for all the help everyone, you're awesome! :D"
243192400879693826,2012-09-05 03:42:41,"Yea, that was it. New PSU works just fine, just had confusing cabling... I'm glad to be online again :)"
243173174680895488,2012-09-05 02:26:17,"@KianAfshari 24-pin to the motherboard, 10-pin and 18-pin to the PSU. Confusing, isn't it? Yes, this is for a computer"
243171295259394049,2012-09-05 02:18:49,"@TexelElf - ""thank you for checking out our very confusing unboxing of the AX850 power supply from Corsair..."" says it all :P"
243169630204596224,2012-09-05 02:12:12,@KianAfshari I'm pretty sure I have to connect both the 10 and 18-pin to the PSU. Just wish this was mentioned somewhere.
243169331985391616,2012-09-05 02:11:01,"@TexelElf if you give me two SEPARATE tips on the same cable, it usually means choose the right one for your setup, especially when modular"
243168894657900544,2012-09-05 02:09:17,"@TexelElf yea, so the 24-pin to the mobo, 18-pin and 10 pin both to the PSU..as far as I can see. Manual doesn't cover this."
243166640714416130,2012-09-05 02:00:19,"@KianAfshari ...I see two cables, I think ""choose the right one"""
243166581859942400,2012-09-05 02:00:05,"@KianAfshari 24 pin connects to mobo, then there's a split between a 18 &amp; a 10 pin - all on the same cable..."
243165866286542848,2012-09-05 01:57:14,"@TexelElf check my latest tweet, I tweeted out a picture of the cable that has/had me confused... Hope it works.. Thanks for the help!"
243163778974375937,2012-09-05 01:48:58,"First time I’ve seen this, might just be me but if there’s two cables, I think I should choose the right one… not both http://t.co/b9dpITdp"
243163186172403712,2012-09-05 01:46:35,"@TexelElf nope, I already had that plugged in. And it wouldn't matter if it wasn't, the PSU should have still fired up for a second.."
243161268284968961,2012-09-05 01:38:58,@TexelElf ...never seen this cable before. This is my first modular PSU ._.
243161167357423617,2012-09-05 01:38:34,@TexelElf but I did notice that I hadn't plugged in another cable attached to the main power cable.. will have to try that.
243160909151883264,2012-09-05 01:37:33,"@TexelElf PSU: Corsair AX850, Mobo: MSI Z77A-G43. I think you're thinking of something else as that IS connected, it powers the CPU..."
243157311676350464,2012-09-05 01:23:15,@TexelElf I'm a bit tired of taking my PC apart though ._.
243157237772734464,2012-09-05 01:22:57,@TexelElf I think that's the problem. This is the first time I've messed with a modular PSU and I didn't know what to do with this cable...
243155442858082304,2012-09-05 01:15:49,"Support was so overwhelming, the stream operators were surprised by how awesome &amp; supportive the #Minecraft community @TwitchTV is! Thanks!"
243155345755742208,2012-09-05 01:15:26,"Absolutely floored by the amount of support shown by the #Minecraft community on Twitch for our panel stream, especially The Pack #PackPride"
243147749359484928,2012-09-05 00:45:15,Still working on the @JIRA for @MojangTeam. First: launching Official #Minecraft Pocket Edition Bug Tracker w/ 0.4.0 release. @jbernhardsson
243131903694233600,2012-09-04 23:42:17,RT @Marc_IRL: Did anyone get video of The Improv Initiative at PAX? Let me know if you come across any!
243107286468415488,2012-09-04 22:04:28,"Sure enough, plug old PSU in and there is life. Guess I need to use that for a bit longer."
243102837465305088,2012-09-04 21:46:47,"Oh, and, the entire cable is black. There is no green or any other color wire…"
243102278356172800,2012-09-04 21:44:34,Can you believe I don’t have a single paper clip in my house? Do staples conduct enough? I might just have to go pick up some paper clips…
243101789535227904,2012-09-04 21:42:37,"System was working, got new Corsair PSU from @NewEggCan, plugged it in, seems DoA. Time to plug in the old PSU, I guess. Sigh."
243100705001439233,2012-09-04 21:38:19,"@Dussed as far as I can see, it isn’t powering up at all…"
242904785920073728,2012-09-04 08:39:48,"@Dussed unfortunately, I don’t believe my motherboard has any power indicators :("
242884254009278466,2012-09-04 07:18:13,"Got new PSU, connected it and the PC won’t start up. Sigh. Could be DoA PSU, mobo issues or human error. Fun."
242826544836403200,2012-09-04 03:28:54,"Helloooo Toronto! Good to be back home, though I'm really sad I had to say goodbye to so many amazing people. I'll see you all again soon!"
242773305306796032,2012-09-03 23:57:21,"Sitting in Philadelphia, waiting for my flight back home. Going to get back home 3 hours later than I thought."
242684908399640576,2012-09-03 18:06:05,"Thanks everyone for pinging @TrinitroToluene, sucks we won’t be able to meet up! :("
242673612618883072,2012-09-03 17:21:12,"@TrinitroToluene yea, completely. Looks like I’ll be going through Philly instead :("
242666714607800321,2012-09-03 16:53:47,Can someone poke @TrinitroToluene (AKA TnT) on Esper IRC and tell him to look at my tweets please? I don’t want him to waste his time :(
242658662336851968,2012-09-03 16:21:48,"Might be on a different flight…, not sure :/. Sorry @TrinitroToluene!"
242651292537868289,2012-09-03 15:52:31,Looking forward to meeting @TrinitroToluene in Calgary. Hopefully he can make it!
242517432906940417,2012-09-03 07:00:37,The TF2 team would approve! #PAX @_grum http://t.co/HaP8ZXgZ
242516358649229312,2012-09-03 06:56:21,.@C418 at the @MojangTeam booth sporting an awesome hat #PAX http://t.co/kpe53CgT
242454211806236673,2012-09-03 02:49:24,Look who else attended our #Minecraft panel! #PAX @SethBling @AntVenom http://t.co/sMoT02OW
242453848428523521,2012-09-03 02:47:58,More pictures from the #Minecraft panel! #PAX http://t.co/QrKW3JXv
242453414473256960,2012-09-03 02:46:14,"Our #Minecraft panel at #PAX was packed, the response from everyone blew us away :) Thanks for joining us! http://t.co/b5qaNgdA"
242451928108371968,2012-09-03 02:40:18,RT @wilw: My friend Greg made this. http://t.co/VY9sarq7
242451499857367041,2012-09-03 02:38:38,Circles! Get them away from me! #PAX http://t.co/bZBCodlM
242450720782176256,2012-09-03 02:35:31,@SlamacowSteven @AntVenom @CavemanFilms @LydiaWinters @SethBling @SkyDoesMinecraf loved meeting you :)
242450600275628033,2012-09-03 02:35:02,RT @SlamacowSteven: It was awesome meeting @AntVenom @CavemanFilms @LydiaWinters @SethBling @SkyDoesMinecraf @EvilSeph and many more at PAX!
242450485804662784,2012-09-03 02:34:34,"The adventure is over, #PAX is done. I had an amazing time and met some awesome people. I am so glad I decided to go :D!"
242219073830809600,2012-09-02 11:15:02,"BEST .party() I’ve ever been to! Thanks @notch &amp; @KyleMcCarthy, you guys REALLY know how to throw a party! Now to try this thing called rest"
242118756048986112,2012-09-02 04:36:24,"To clarify: panel starts around 3 hours, 5 minutes and 30 seconds at http://t.co/jjAXbM3u"
242118295241777152,2012-09-02 04:34:34,"@pgeuder @Marc_IRL @KrisJelbring @xlson ok, we’ll be down. Cc: @Dinnerbone"
242117111017787393,2012-09-02 04:29:52,"If you missed our #Minecraft panel from #PAX on @TwitchTV, you can watch it from the archives here: http://t.co/jjAXbM3u"
242116122311270400,2012-09-02 04:25:56,"@Marc_IRL we’re at the hotel, will probably leave at 10pm. When were you planning to leave? @KrisJelbring @xlson"
242105707497914368,2012-09-02 03:44:33,"Recharging a bit before the .party(); Might head over a bit later than we thought. Been a long, awesome day!"
242096872704077824,2012-09-02 03:09:27,Had such a blast with our panel! The #Minecraft community is so supportive and awesome! Thanks for the support!
242031368207474689,2012-09-01 22:49:09,Want to watch our #Minecraft panel? Schedule here (all times PDT): http://t.co/1WrYuCao &amp; stream here: http://t.co/GPtNVJgy #PAX
242021608376643584,2012-09-01 22:10:24,Epic #Borderlands2 statues! Can’t wait for Sept 18! #PAX http://t.co/M9IGPzHb
242020514250518528,2012-09-01 22:06:03,Awesome card tower #PAX http://t.co/yF7jN8pg
242018443837186048,2012-09-01 21:57:49,A taste of things to come… In ~1 hour and 35 minutes #PAX http://t.co/VKeeaEs5
242016846004498432,2012-09-01 21:51:27,"RT @CristinaRTC: Scedule of events being streamed on this specific channel, http://t.co/tbE1tML2 , is here http://t.co/7Tck17lQ"
242016812118708224,2012-09-01 21:51:19,RT @CristinaRTC: @EvilSeph DAt Kraken theatre action right hurr http://t.co/tbE1tML2
242008999225065472,2012-09-01 21:20:16,"I believe our #Minecraft panel will be streamed by @TwitchTV, so of you aren’t at #PAX, you can watch us there!"
242007044893335552,2012-09-01 21:12:30,Absolutely enjoying the Pad Thai from Thai Ginger! Relaxing for a few hours before our panel After @notch: The New #Minecraft Team at 4:30pm
241951085068177408,2012-09-01 17:30:08,"I’ll be wearing a blue, red and white shirt with a black top hat like the rest of the Mojangstas, hope to see you there! #PAX"
241951023676133376,2012-09-01 17:29:53,"Day 2! Back at the @MojangTeam booth from 9:30am-2pm, come meet the #Minecraft team, we’re all here for the morning shift! #PAX"
241790362706907137,2012-09-01 06:51:29,@CristinaRTC go to bed. What happened to it being easier to fix your sleep schedule while I’m away? :p
241773101975736320,2012-09-01 05:42:54,.@Marc_IRL’s improv panel was absolutely fantastic! Now time for the Curse party!
241772866624974850,2012-09-01 05:41:57,"RT @Marc_IRL: Holy crap, we packed a 300 person theater and tore it up. Thanks to all who attended, and thanks to all of our panelists!"
241745610280157185,2012-09-01 03:53:39,"Getting ready to watch @Marc_IRL do some awesome improv, can’t wait! #PAX"
241731932478652416,2012-09-01 02:59:27,Awesome @PlantsvsZombies plushies #PAX http://t.co/bj1z5nNt
241729205270884352,2012-09-01 02:48:28,Feet are hurting but it is all worth it. Resting before @Marc_IRL &amp; friends’ improv panel &amp; Curse party later tonight! #PAX
241690480763621376,2012-09-01 00:14:35,RT @EdmundMcMillenn: The Basement Collection has been released! only $4 baby! http://t.co/6i2cSJ3B help spread the word! XOXO
241690411515645952,2012-09-01 00:14:19,"RT @mollstam: Well, skin servers seem to be happy now. Also committed some code the other day to the Minecraft client for better error r ..."
241650488037220354,2012-08-31 21:35:42,New mob? Dapper Skeleton Creeper! #PAX #Minecraft http://t.co/4iS0GLEZ
241649297920237568,2012-08-31 21:30:56,RT @MojangTeam: If you're at PAX make sure to stop by the Museum of Mojang on the 6th floor :) http://t.co/Q6pxAQ0M
241647267952619521,2012-08-31 21:22:54,Dapper Agent Cobalt! #PAX http://t.co/QysWvDUz
241579048080375808,2012-08-31 16:51:48,"10 minutes until the fun begins, I’ll be at the booth from 9:30 to 2:00, come say hi and check out our amazing booth! #PAX"
241421260867915776,2012-08-31 06:24:48,"@CristinaRTC me too ._., sleep well!"
241415479581876224,2012-08-31 06:01:50,"@lolwithtim we went to Dahlia Lounge, expensive but really good food. I would definitely say it was worth it"
241396955165642752,2012-08-31 04:48:13,"Starving, finally having a really late dinner and just about to pass out. Excited for tomorrow morning, hope to see you at our booth! #PAX"
241313167756627969,2012-08-30 23:15:17,@CristinaRTC http://t.co/kGvikSK1
241312500279296000,2012-08-30 23:12:38,"Eyes are still hurting…should not have slept on the plane with contacts on, but the nap helped a lot! #PAX"
241312171978534912,2012-08-30 23:11:19,"Had an hour nap, about to go meet up with some Mojangstas in the lobby to continue our adventures! #PAX"
241266954311180288,2012-08-30 20:11:40,"I met your cousin, @TrinitroToluene! Looking forward to meeting up! http://t.co/xCeIXlI4"
241266009925885952,2012-08-30 20:07:55,We found goooolllddd! #PAX http://t.co/1VrgR7kc
241265516231155712,2012-08-30 20:05:57,Our pickaxes are so much better though! #PAX http://t.co/WvQiSUwC
241264848904790016,2012-08-30 20:03:18,We felt right at home! #PAX http://t.co/EcWrywwB
241228825822896129,2012-08-30 17:40:08,"Free Internet in the lobby, yay! #PAX"
241228664900038656,2012-08-30 17:39:30,"Had breakfast with @jeb_ @LydiaWinters @Dinnerbone @Marc_IRL and the rest of the Mojangstas, now we’re going to go check out Seattle! #PAX"
241068483402686464,2012-08-30 07:02:59,"Finally in Seattle and in the hotel. Internet not included with the room :(. Been a long day, can’t wait for the rest of the weekend! #PAX"
240963909677375488,2012-08-30 00:07:27,"Finally boarding! Can’t wait to pass out on the bed in my hotel room! Should be a 3 hour flight, I think. Not too bad :) #PAX"
240940874995990528,2012-08-29 22:35:55,"@CristinaRTC it’s less than a week :), but the silence will be really odd…"
240936658705469440,2012-08-29 22:19:10,"@EpicSledge extra security? I never said that was a bad thing. The flight being delayed sucks, but it is only an hour :)"
240935705604395008,2012-08-29 22:15:23,"Had to undergo a random search and flight is delayed by an hour. Off to a great start ;), but still going to have a blast :D #PAX"
240466408478212096,2012-08-28 15:10:34,"RT @vraket: Cobalt has been updated to v111, full change log here: http://t.co/YTiAwLes"
240460831056330752,2012-08-28 14:48:24,"@Marc_IRL Excuse the caps... HELL YES, COOP!"
240458789600518144,2012-08-28 14:40:17,Binding of Isaac remake? Hell yes! Can't wait for more details! http://t.co/xmtxPXAY
240456529231372289,2012-08-28 14:31:18,"@tehMorag yea, I'll be at PAX with the rest of the @MojangTeam! Not sure how busy we'll be, but I'd definitely love to meet up!"
240237636067930112,2012-08-28 00:01:30,@TrollbombTTV @kirjain @CristinaRTC here's another cat attempting it http://t.co/Hf8wD32W
240231604163866624,2012-08-27 23:37:32,@kirjain @TrollbombTTV @CristinaRTC http://t.co/CCRVPhg5
240092104590766080,2012-08-27 14:23:13,@TrollbombTTV Awwters! http://t.co/aX1k7uk8 http://t.co/H6niMLRv
240066298346864641,2012-08-27 12:40:40,"I love tinkering with things, setting things up and tweaking them. Having so much fun with @Atlassian's @JIRA for @MojangTeam!"
239986454187626496,2012-08-27 07:23:24,RT @jeb_: This week we're heading to PAX Prime in Seattle! Make sure you visit our booth if you're going there!
239880200857456640,2012-08-27 00:21:11,"@CristinaRTC wooo, about time! xD"
239879234628239360,2012-08-27 00:17:20,It's Sunday again! #Borderlands with @Dorkerific @Eddie_Ruckus and @Fngeddie! This is going to be interesting... http://t.co/oObxW0mn
239531806658031616,2012-08-26 01:16:47,@Vareide glad to see my staff have dealt with this already :)
239234636742545408,2012-08-25 05:35:56,RT @Tawnithan: Do you love @Eddie_Ruckus as much as we do? Would you like to help him get to college this semester? Donate here: http:// ...
239228745314091009,2012-08-25 05:12:32,A new @CraftBukkit Beta 1.3.2-R0.1 is now available! See http://t.co/JNo3e4Nf for more information. #Bukkit
239209118068527106,2012-08-25 03:54:32,"Some coffee, some food and we're ready to go. Though still pretty tired, feels like I barely slept."
239127998421426177,2012-08-24 22:32:12,"Playing #Minecraft on the @RuckusCraft server with @CristinaRTC and having a blast, come watch and chill with us :) http://t.co/29OjB2zu"
238985889106251776,2012-08-24 13:07:30,RT @jeb_: Minecraft snapshot 12w34b: http://t.co/9OTXiJQ4
238662251320586241,2012-08-23 15:41:29,RT @carlmanneh: Here's the Weekly Chunk from Mojang – Pax/Minecon/Snapshot http://t.co/yx7fqPPj
238496720324026368,2012-08-23 04:43:43,@Marc_IRL attaching a shock mount and pop filter isn’t as easy as I’d like given the price…
238496547648720897,2012-08-23 04:43:02,@Marc_IRL I was looking into that too. Only concern is the hackjob you have to do to get it setup
238386939345125376,2012-08-22 21:27:30,"@carlmanneh awesome, can't wait to chill with the rest of the Mojangstas again! :D"
238326642353790976,2012-08-22 17:27:54,Thanks everyone for participating in our discussion on the #Minecraft API proposal process! More coming in the future! http://t.co/oGLWEgXE
238082045648203776,2012-08-22 01:15:57,@Yitomic @NewEggCan too difficult to troubleshoot...
238080642615750656,2012-08-22 01:10:23,"Just ordered a new PSU from @NewEggCan. Hopefully the problems are caused by my old PSU and not my motherboard, we'll just have to see..."
237880232932163585,2012-08-21 11:54:01,Tell me about it... RT @ezchili ALERT ALERT COFFEE IS NOT HELPING HELP ME
237876484683993089,2012-08-21 11:39:08,@LydiaWinters the picture is cute as a whole..but when you notice the claw..and what it is doing... Nightmare material
237857023390277633,2012-08-21 10:21:48,Random question: cute or freaky? http://t.co/EWbqjgj7
237856735598100481,2012-08-21 10:20:39,"Spent whole day troubleshooting, fun. Got powered USB hub, no problems yet. Only time will tell… Will probably replace things anyway"
237853668555243520,2012-08-21 10:08:28,@Dussed yes
237840307272708096,2012-08-21 09:15:22,"@Dussed missed this tweet, sorry. I have a MSI Z77A-G43"
237587478079500288,2012-08-20 16:30:43,@Dussed random...completely random ._.
237587272386621440,2012-08-20 16:29:54,"@Dussed didn't see any... will have to check again when/if it dies again. Hoping on ""if""."
237586815098421249,2012-08-20 16:28:05,"@Dracoco11 thanks for the heads up, makes dealing with this problem easier :P"
237586625507504129,2012-08-20 16:27:20,@Dussed I have. Anything specific you had in mind?
237586446100332544,2012-08-20 16:26:37,"@Valandur *all* USBs die at the same time. Then when Win tries to reconnect them, it fails. Unrecognised devices b/c they aren't powered"
237586076175306753,2012-08-20 16:25:09,"@HeresvilleMC everything ""was fine"" until I plugged something in there... that's what I'm hoping..."
237585951696777216,2012-08-20 16:24:39,"@HeresvilleMC I'm *hoping* it is actually *caused* by the front ports, going to try and go without using them."
237585678299430912,2012-08-20 16:23:34,"@TaranMoltu already done, no difference. It's really frustrating because I can't forcibly cause it, I have to just wait and see."
237585453132419073,2012-08-20 16:22:40,@RyanGoggin believe I have a 750w PSU. It is either failing or the motherboard is faulty
237583934530138112,2012-08-20 16:16:38,"On the bright side, I now have 9K followers on Twitter. Thanks for the support everyone :)"
237583698202079232,2012-08-20 16:15:42,"The dying is so random &amp; intermittent, tracking down the cause is going to be nearly impossible. Make small tweak, wait for it to die. Fun."
237582975015993344,2012-08-20 16:12:49,"@Yitomic multiple devices.. actually, every peripheral...so I can't use my system when the USB power fails across the motherboard D:"
237577516955611136,2012-08-20 15:51:08,I wish it was as simple as turning off power saving :(. It still dies after a random amount of time
237571998853783552,2012-08-20 15:29:13,"The motherboard is new… it might be faulty, I changed CPU, RAM and motherboard a few months ago. So doubt it is PSU."
237570810016063488,2012-08-20 15:24:29,I’m thinking either PSU or motherboard. Time to break out the laptop for work.
237570145944469505,2012-08-20 15:21:51,USB devices keep losing power. No idea what’s the cause. Blindly replace everything? #sigh
237383622481555456,2012-08-20 03:00:40,"Finally managed to play some #Borderlands with @Dorkerific and @Eddie_Ruckus, it's been a while and I had such a great time! Thanks :D"
237359765729189889,2012-08-20 01:25:52,RT @CristinaRTC: I like going around and taking screenshots :) @RuckusCraft Amazing server amazing man @Eddie_Ruckus &lt;3 http://t.co/n ...
237326614684381184,2012-08-19 23:14:08,RT @Eddie_Ruckus: Gonna do some Borderlands with the awesome @Dorkerific and @EvilSeph ! http://t.co/mpImVpIi
237326588277035008,2012-08-19 23:14:02,RT @Dorkerific: Borderlands NOW! @EvilSeph @Eddie_Ruckus http://t.co/OjKZ89QL
237299657485742082,2012-08-19 21:27:01,"@DeliciousJaffa waiting for reports and confirmation, but I believe that had been addressed"
237275561649647616,2012-08-19 19:51:16,Absolutely exhausted but can’t sleep…Don’t you just hate that?
237177363027329024,2012-08-19 13:21:04,A new @CraftBukkit RB 1.3.1-R2.0 is now available! See http://t.co/yNNgGMIa for more information. #Bukkit
236522489998610434,2012-08-17 17:58:50,"We're focusing on @CraftBukkit performance and stability right now, then API additions. #Bukkit"
