509071277714595841,2014-09-08 20:10:25,"@Cloudhunter @JadedcatWylde @ZeldoKavira Correct, you're quoting a page that can be edited at any time. It did not say that before I tweeted"
509070640041967616,2014-09-08 20:07:53,.@Cloudhunter @JadedcatWylde @ZeldoKavira Removed Unofficial Builds policy which protected against malicious builds. http://t.co/i2VAbswMXb
509070151845961728,2014-09-08 20:05:56,".@Cloudhunter @JadedcatWylde Correction, it was @ZeldoKavira http://t.co/yi0N0lnquy but still Curse."
509065601353285632,2014-09-08 19:47:52,Highly irresponsible of @JadedcatWylde Curse to remove a rule that protected servers in the community for years now. https://t.co/Elmg9QEYSy
502384952944885760,2014-08-21 09:21:21,"Yes, Mojang does own Bukkit. Them acquiring us was a condition to being hired. If Mojang want to continue Bukkit, I'm all for it :)"
502360729803317248,2014-08-21 07:45:06,.@CraftBukkit: It's time to say goodbye - http://t.co/LRG2uiMbDe
472988611604791296,2014-06-01 06:30:47,A new @CraftBukkit for Minecraft 1.7.9 Beta Build is now available! See http://t.co/xtZ2JOrkwk for more information. #Bukkit
466778879768547330,2014-05-15 03:15:31,A new @CraftBukkit for Minecraft 1.7.9 Beta Build is now available! See http://t.co/cOfwpBREYr for more information. #Bukkit
456872542016634880,2014-04-17 19:11:16,A new @CraftBukkit for Minecraft 1.7.9 DEVELOPMENT build is now available! See http://t.co/gZedXpIJul for more information. #Bukkit
454827182724886528,2014-04-12 03:43:45,A new @CraftBukkit for Minecraft 1.7.8 DEVELOPMENT build is now available! See http://t.co/USvjOWlGjp for more information. #Bukkit
454795906148077568,2014-04-12 01:39:28,"PSA: Change your (Bukkit) passwords to be safe, Heartbleed security hole - http://t.co/XwN6CY7Z3W"
450466419730579456,2014-03-31 02:55:38,PSA: The Switch to UUIDs - Potential @CraftBukkit Plugin/Server Breakage: http://t.co/mRAhInxsv7
448954014667788288,2014-03-26 22:45:52,".@DinozServer @MCPHSupport As far as we know, @CraftBukkit does NOT have the crashing issue. We perform extensive QA before promoting builds"
447486405267038208,2014-03-22 21:34:07,"As part of efforts to approve approval times, we now require projects to have files submitted before being accepted. More changes to come."
447485974319095808,2014-03-22 21:32:24,"We've made many changes, brought on many more staff but things have still been degrading. This is unacceptable &amp; will be addressed."
447485275799691265,2014-03-22 21:29:38,"I, personally, apologise for the poor BukkitDev approval times we've been having. We will fix this and bring approval times back down."
447478108946317312,2014-03-22 21:01:09,"Sorry for the lack of activity on my part, I'm busy moving :("
447471600330215425,2014-03-22 20:35:17,A new @CraftBukkit for Minecraft 1.7.5 DEVELOPMENT build is now available! See http://t.co/XQ5jIzyp5c for more information. #Bukkit
433663195014639617,2014-02-12 18:05:37,"Happy Birthday @TrinitroToluene! Thanks for keeping the Bukkit Forums awesome, and all the wisdom and the advice on decisions I make!"
433496007834206208,2014-02-12 07:01:16,A new @CraftBukkit for Minecraft 1.7.2 Beta Build is now available! See http://t.co/86M3rzEU9q for more information. #Bukkit
433359076500574208,2014-02-11 21:57:09,@x3sphere Oh god. I don't use their site but tweets don't have enough content to utilise that design effectively :\
433352879609372672,2014-02-11 21:32:32,"@GWKrovikan ""Play as an Imperial and play in any Alliance. Gain unique bonuses, crafting styles, gear and more!"" from the pre-order page."
433345131177971713,2014-02-11 21:01:45,"This, on top of ESO having an exclusive race for people who buy the collectors edition of a box price MMO with a sub fee is really sketchy."
433344486828036096,2014-02-11 20:59:11,"Anyone else feel like the ESO NDA handling is shifty? Only lifting NDA for exclusive list of people, a list you want to stay on at all costs"
433321741666885632,2014-02-11 19:28:48,"SteamDevDays: http://t.co/tfl2L8j98s - well, there goes my week. So much to learn from this event, glad they made a site dedicated to it."
433119552839249920,2014-02-11 06:05:23,"For the thought process behind @CraftBukkit's new Minecraft command handling, I wrote an article here: http://t.co/xU26nGCAM2"
433119267434033152,2014-02-11 06:04:14,Help us reach a promoted build! Test the new command and alias handling: http://t.co/a1ZQv3JeBW - Report bugs on http://t.co/A9sEoG4A1D
433055518198726656,2014-02-11 01:50:55,"Working on documentation to explain the new &amp; improved aliases and command block overrides system, would appreciate testing when posted. :)"
433054996855140353,2014-02-11 01:48:51,"@A_Pasz96 I know, it sucks..I absolutely loved the first two :( I bought the third to support the franchise, but this is just unacceptable."
433054367415939072,2014-02-11 01:46:21,"I mean, seriously.. what the hell? You can't make this up... http://t.co/nhMZg53yLl"
433053767173668864,2014-02-11 01:43:58,"The developer of Batman: Arkham Origins has said they'll not be fixing game breaking bugs, instead they'll work on DLC. DLC I will not buy."
433052769537105920,2014-02-11 01:40:00,How is it ever a good idea to blatantly tell your customers you'll not be fixing the issues that prevent them from playing your game...
432919403269599232,2014-02-10 16:50:03,@wouterrr make a private ticket on http://t.co/cgqHUIEIoU - thanks for wanting to responsibly report it!
432577597726556160,2014-02-09 18:11:50,"The best way to help @CraftBukkit reach a promoted build is to test and report bugs. If a bug isn't reported, we can't fix it."
432193729286266881,2014-02-08 16:46:29,"BukkitLog 1.7: @CraftBukkit 1.7.2-R0.3, Minecraft 1.7.4 update - experimenting with ETA-esque communication: http://t.co/Rawc9inzH4"
432192444839776256,2014-02-08 16:41:23,"@therealeq2 I don't believe so, no. If it currently is, this isn't intended behaviour and will probably be fixed."
432063637935489024,2014-02-08 08:09:33,Fleshed out the @CraftBukkit Minecraft commands support idea and updated the article: http://t.co/xU26nGCAM2
431665444148109312,2014-02-07 05:47:16,"@Hawkee I'd prefer discussion in the comments on http://t.co/0JMgSNykRU, twitter isn't great for sustained discussion :)"
431624352497295360,2014-02-07 03:03:59,"Whoops, looks like I need to add a bit more to that article and fix some things up too."
431603760960253953,2014-02-07 01:42:10,"Updated the ""Bukkit: Supporting Minecraft Commands"" article I posted 2 days ago with more information, http://t.co/xU26nGCAM2"
431183260555554816,2014-02-05 21:51:14,I'm seeing more ported games use reviews from their previous platform to sell their game and that's just misleading.
431183089914486784,2014-02-05 21:50:34,Reviews for games should be per-platform. An Xbox review shouldn't apply to a ported PC game as they have different experiences/quirks.
430881210097614848,2014-02-05 01:51:00,"Now this is an example of where gaming SHOULD go, this is a brilliant idea: http://t.co/YNLUxFXHem"
430873649688870912,2014-02-05 01:20:57,"I'd appreciate any discussions on my articles take place in the comments, twitter isn't really suited for sustained discussions :)"
430786945464434688,2014-02-04 19:36:26,"Bukkit: Supporting Minecraft Commands - discussing the impact of Minecraft commands on Bukkit &amp; CommandBlock support, http://t.co/qT7mzQXUj5"
430749026418323456,2014-02-04 17:05:45,"@Hawkee not yet, sorry, got a few things I need to write about Bukkit that are higher priority and issues sleeping makes it tricky too..."
430425804267589632,2014-02-03 19:41:23,Surely this violates most advertising provider policies? Please?
430425578005880832,2014-02-03 19:40:29,Forcing people to click on an ad or wait 30mins to keep playing a game is ridiculous. Mobile gaming is out of control http://t.co/1pMXY76TIA
430049307556077568,2014-02-02 18:45:19,"@mcwurth ..like releases, security/PSAs etc, don't want to post if not needed. More info can be found on http://t.co/Y9jXc5nNJe for now"
430048675310481408,2014-02-02 18:42:48,"@mcwurth not sure what you're looking for, the front page of http://t.co/xmWnAWD69c is only for important information for server admins..."
429678075081940992,2014-02-01 18:10:10,Happy to see @CraftBukkit PRs moving again! There's still a lot of work I need and want to do to improve on our handling though
429378385903894528,2014-01-31 22:19:19,"@AlanthyaMC I love Dungeon Keeper, that's why I'm so mad they destroyed it like this :("
429353445112705024,2014-01-31 20:40:12,"If you keep giving companies like EA money, this is what the future will look like: https://t.co/ZwqbeMtw2T"
429352094638690304,2014-01-31 20:34:51,Why do we keep encouraging these models by giving these companies money? Support an indie developer instead that actually cares about you.
429351563123888129,2014-01-31 20:32:44,I thought paying for an exclusive race in a subscription based MMO with a box price was bad. Now you have to pay to do ANYTHING in a game?
429338830748274688,2014-01-31 19:42:08,"@dbussink @github @GitHubHelp awesome, thanks :D"
429094781768458240,2014-01-31 03:32:22,Any way to turn off word wrapping in diff view @GitHub? Seems to be doing it for source files and not just prose. CC: @GitHubHelp
429012817174220800,2014-01-30 22:06:40,"BukkitLog 1.7: mc-dev update delays - briefly explaining why mc-dev hasn't been updated yet, http://t.co/rWHtNAgrwk"
428995927446024192,2014-01-30 20:59:34,"Writing new articles for http://t.co/0JMgSNykRU, sorry for the wait :)! Difficulty sleeping+being sick is not a fun combination."
427310318629298176,2014-01-26 05:21:33,@TrinitroToluene thanks mate :D
427310001472827392,2014-01-26 05:20:18,"Thanks for all the birthday wishes everyone!  Got a 3DSXL for my birthday, looking forward to playing its awesome games!"
427180064506011648,2014-01-25 20:43:58,"Yay, got better in time to spend my birthday with my awesome family! Hope everyone's day is going fantastically!"
424970440516173825,2014-01-19 18:23:43,"@The804R I didn't say links ;), Omnibar results aren't links either and it works there"
424969879217647616,2014-01-19 18:21:29,"@The804R try searching for something on YouTube, middle click a result. Does it open in a new tab? :P"
424952199501070336,2014-01-19 17:11:14,"Our @CraftBukkit @GitHub twitter bot keeps randomly breaking so commits aren't getting tweeted. We're still active, check GitHub!"
424951604677074944,2014-01-19 17:08:52,"@NicoPegasus @firefox I figured as much, but I meant sites like YouTube should support it in their search, etc. ;)"
424950900008841217,2014-01-19 17:06:04,"@NicoPegasus @firefox not talking links, but typing something in the Omnibar, getting a list of suggestions and middle clicking on one"
424949959755304960,2014-01-19 17:02:20,TIL you can middle click entries in the Omnibar in Chrome to open them in a new tab. Now I want everything to support middle click.
424946300556046337,2014-01-19 16:47:47,"All I want to do is work on Bukkit and write articles for http://t.co/0JMgSNykRU, instead I'm sick and wasting time sleeping. Frustrating."
422805037715562496,2014-01-13 18:59:10,"@HomeDepotCanada we did finally get a call, delivery truck got into a fender bender but status updates would be appreciated for delays :)"
422802156870057984,2014-01-13 18:47:44,"@HomeDepotCanada thanks for getting back to me :), delivery co. stepped up and delivered on Sunday unexpectedly, we now have our appliances"
422141051366031360,2014-01-11 23:00:44,"Delays with delivery are fine (bad weather, etc.) but we haven’t received any call explaining delays, which is unacceptable @HomeDepotCanada"
422140511869480960,2014-01-11 22:58:35,"Not happy @HomeDepotCanada , we wasted a full day waiting for delivery. Family took off work when we got the confirmation call yesterday."
422139861693661185,2014-01-11 22:56:00,"Bought appliances for family from @HomeDepotCanada - delivery scheduled for today. Got confirmation, yet no show or call about being late."
420989589898403840,2014-01-08 18:45:14,RT @gmcferrin: @EvilSeph Can I get a birthday RT? Trying to raise money for @ACFB &amp; @nokidhungry with my @HungerWalkATL team. http://t.co/Y…
420612986198585344,2014-01-07 17:48:45,"Reminder: much of @CraftBukkit is still on vacation, sorry for the slow progress but spending time with loved ones is very important :)"
420260359317241857,2014-01-06 18:27:32,"@aHeroesHeart you aren't the first person to report this. Think it is a Minecraft/Netty issue. Unable to reproduce, it's too random..."
418245224163725312,2014-01-01 05:00:06,"Happy New Year everyone! Thanks for the continued support with @CraftBukkit and my site, http://t.co/Y9jXc5nNJe ! Wish you all the best! :)"
415711728467709952,2013-12-25 05:12:54,Happy Holidays everyone! Hope you’re having a great time with loved ones! Be thankful for them :)
415186908184969216,2013-12-23 18:27:27,"BukkitImprov: (The Impact of) Third Party Support - discussing the Unofficial Builds Policy and Third Party Support, http://t.co/yjOXQUKpAf"
414909639831347201,2013-12-23 00:05:41,@MenaceInc it’s a common mistake for people to use could/couldn’t of :p
414900097466392576,2013-12-22 23:27:46,"@MenaceInc also, thanks for saying ""couldn't have"", that makes me happy ;p"
414899615130202112,2013-12-22 23:25:51,"@MenaceInc I'm also not impressed with iPhone 5(S), iOS7 and how restrictive iOS is, will likely move to Android to be honest..."
414899363052146688,2013-12-22 23:24:51,"@MenaceInc money causes people to make rash decisions sometimes. I can see benefits of the extras, but it was poorly communicated/handled"
414890695657152512,2013-12-22 22:50:24,"BukkitImprov: Directed Discussions to Improve Bukkit - open, welcoming discussions on various Bukkit related topics, http://t.co/iT51fmPXEr"
414885911285858304,2013-12-22 22:31:24,"@MenaceInc to my knowledge, they did not disclose these 'extras' to anyone &amp; obviously had no statement/announcement prepared. It's telling."
414885627482492928,2013-12-22 22:30:16,"@MenaceInc he said, she said. Only 1 side of the story. Like I said, more concerned with how they handled the release &amp; what followed after"
414827383334510593,2013-12-22 18:38:49,"@MenaceInc their statement doesn’t matter, their behaviour is questionable. If they’re ignorant, what else got “sneaked” in under their nose"
414826810363240449,2013-12-22 18:36:33,@MenaceInc the sudden and sneaky manner with which everything is being handled has me reluctant to trust anything unverified from that team
414823193530998784,2013-12-22 18:22:11,@MenaceInc are you aware of the issues/drama around it? Not sure it can be trusted mate :/
414305818087940096,2013-12-21 08:06:19,A new @CraftBukkit for Minecraft 1.7.2 Beta Build is now available! See http://t.co/JQw8BNbnDW for more information. #Bukkit
413181043471286273,2013-12-18 05:36:51,A new @CraftBukkit for Minecraft 1.7.2 Beta Build is now available! See http://t.co/Ec4zNtTpZM for more information. #Bukkit
411672108138119168,2013-12-14 01:40:53,"@TechStackLP http://t.co/cgqHUIEIoU - easy to remember :), make sure to test without plugins and if it happens in Vanilla Minecraft!"
411651996941578240,2013-12-14 00:20:58,Want to help? Run the latest @CraftBukkit dev build on a test server and report any bugs you find! Helps us get to a promoted build!
411651591855300608,2013-12-14 00:19:22,@ArmEagle You're very welcome! Would really appreciate it if you left a comment with any feedback you have! :)
411600589164797952,2013-12-13 20:56:42,BukkitLog 1.7 - Emphasising a Strong Foundation: http://t.co/du2XEv5R3K
411282753619910656,2013-12-12 23:53:44,"@mcpvptissin it's not intended to address that, BukkitLog is purely directed at developers not server admins."
411278070969274369,2013-12-12 23:35:07,The BukkitLog introduction article also covers some communication challenges we face as a large project. Hope the insight is educational!
411277739979579392,2013-12-12 23:33:49,"BukkitLog: Developer-centric Communications - trialing better, focused communication for @CraftBukkit plugin devs, http://t.co/HwkqrhD13N"
411216801951789056,2013-12-12 19:31:40,"@Coestar I realise that, but could unfortunately be taken as such by others :(. I love feedback and, as an extension, the project does too!"
411213538431365120,2013-12-12 19:18:42,"@Coestar We don't agree w/ that sentiment, in fact we welcome all feedback/criticism from everyone. I responded here: http://t.co/kwzIfK3B5N"
410872628019081216,2013-12-11 20:44:02,"@piratelv ah hah, no problem! Thanks for reading and the feedback, it is much appreciated!"
410871084271931392,2013-12-11 20:37:54,"@piratelv hmm, not sure what you mean?"
410868525821988864,2013-12-11 20:27:44,Taming Minecraft Server's Log4j2 - Basics: http://t.co/QfVe64AgaN - Replicating 1.6 Style Logging
409770319432278017,2013-12-08 19:43:51,"Happy you're eager to discuss improvements for @CraftBukkit project, but comments on specific topics should wait for related articles :)"
409757287897522176,2013-12-08 18:52:05,Been readying http://t.co/wxKwltiM1n for discussion on @CraftBukkit project. Would love for you to join in! Let's improve things together :)
409753737154932737,2013-12-08 18:37:58,"Happy to be writing again! :D Hopefully I can keep up the energy, haven't been sleeping well lately leading to low energy :("
409753253342351360,2013-12-08 18:36:03,"Reinventing my blog, insightfowl - Plans for the Future: http://t.co/5CVgv70jMb . Please let me know what you think in the comments :)"
409741675989577728,2013-12-08 17:50:02,"@Party_Blockland heh, thanks. I didn't realise until you mentioned it :P"
409741545726681088,2013-12-08 17:49:31,"@natekontny haven't thought things through, just started really using it recently. Editors vs. Readers maybe?  Similar to Google Docs?"
409738723707084800,2013-12-08 17:38:18,"@natekontny hi :), are the documents I create on @gooddraft private until I share the URL? Any plans for explicit permissions?"
409054051645415424,2013-12-06 20:17:40,"@MineChatApp even if we fix this, you're better off adhering to Vanilla Minecraft spec (i.e. doing what th client does) for future proofing."
409053787236466688,2013-12-06 20:16:37,"@MineChatApp we're looking into it. Had to remove ticket because it broke our community rules, sorry! If valid, will create a new ticket."
407236803104489472,2013-12-01 19:56:34,"Reminder: if you're going to run @CraftBukkit development builds and help test, you need to stay on top of them when we release more."
407209845235154944,2013-12-01 18:09:27,"@WhiteBoy4ths we haven't worked on the new commands yet (each new command requires API additions), this is just the first development build."
407208700474970112,2013-12-01 18:04:54,@MightyPork keep the repository clean and not spam twitter/IRC with hundreds of commits? We retain separate commits internally.
407208467267473408,2013-12-01 18:03:58,"@Dannysan626 it should work, but as it is a dev build...there could be problems."
407208040308301824,2013-12-01 18:02:17,We're overwhelmed by the amount of kind words we're receiving and how many people are willing to test to help us towards a RB/beta build!
407207643502362624,2013-12-01 18:00:42,"@INSANEGRAPE43 yes, just like with Minecraft: server-icon.png within your server directory."
407207385988489216,2013-12-01 17:59:41,"@CoderKiwi if you're sure it is a bug+have tested to make sure it isn't within Minecraft itself, use our bug tracker: http://t.co/cgqHUIEIoU"
407207145268985856,2013-12-01 17:58:43,"@DtownIan we made sure to test that before releasing dev build, XP was definitely being generated from mining, seemed invisible sometimes"
407206196307705856,2013-12-01 17:54:57,"@BaileyPay feel free, but the API is not at all stable. We haven't even begun to work on it to shift over to 1.7."
407057860997042176,2013-12-01 08:05:31,"Claiming credit for a release that you barely put any work into and then having the nerve to ask for donations for it, that's a new low."
407046651560620032,2013-12-01 07:20:58,".@stuntguy3000 the date of the commit is when we first started work on the update,  we then squished all our work into one commit"
407043607103692800,2013-12-01 07:08:53,"It really isn't wise to bite the hand that feeds you; some projects would not exist without us, yet they choose to belittle the work we do"
407042949260656640,2013-12-01 07:06:16,".@stuntguy3000 still waiting for my apology, http://t.co/SVa1QvOro6"
407042050752667648,2013-12-01 07:02:42,It really annoys me when people take credit for our hard work and then have the audacity to badmouth us in the same breath.
406965524002648064,2013-12-01 01:58:36,A new @CraftBukkit for Minecraft 1.7.2 DEVELOPMENT build is now available! See http://t.co/lyEVrHbKCC for more information. #Bukkit
406813626020810752,2013-11-30 15:55:01,"We're seriously lacking sleep. Really proud of my @CraftBukkit team. Bunch of awesome, smart people putting in so much work for this update."
406704074134802432,2013-11-30 08:39:42,"Finally got out of the portal, absolutely exhausted! Good night!"
406472986514821120,2013-11-29 17:21:26,"Stuck in a nether portal, can't get out! HELP!!!"
406141238639730689,2013-11-28 19:23:11,"@AnUnknownMiner I see, cool! To clarify, invisible fire bug was found a while ago in another update. Was just noting one of our funnest bugs"
406134605993873409,2013-11-28 18:56:50,"@AnUnknownMiner the state of API in those builds should not be relied upon at all. Things may or may not change, it depends. What thread?"
406119456486588416,2013-11-28 17:56:38,"We do NOT recommend running our first few @CraftBukkit 1.7.2 dev builds, they WILL be unstable, entirely unsupported &amp; need a lot of testing"
405760324030443520,2013-11-27 18:09:34,@MysteryKMS you don't know what invisible fire looks like?
405744442445164544,2013-11-27 17:06:28,"Best bug we've caught before @CraftBukkit dev build? Inivisible, unextinguishable, infinite fire on the ocean floor and everywhere else."
405472738879340544,2013-11-26 23:06:48,"We'll likely have an unsupported, unstable @CraftBukkit 1.7.2 dev build this week if nothing comes up: first dev build that simply compiles"
405445660754731008,2013-11-26 21:19:13,"Even though #Minecraft 1.7.3 is out next week, seems like it is mostly client fixes, so likely won't affect progress on @CraftBukkit 1.7.2"
405410872987643905,2013-11-26 19:00:58,Seeing rumours; we're NOT withholding a @CraftBukkit 1.7.2 dev build. None exist yet. We're still working hard towards our first one #bukkit
404399076117987328,2013-11-24 00:00:27,"We communicate through my twitter @EvilSeph, http://t.co/xmWnAWD69c and our Announcements Google Group exclusively. Anywhere else is not us."
404398759624196096,2013-11-23 23:59:12,Just discovered someone created a Facebook page for Bukkit. This is NOT an official @CraftBukkit page and the person running it is lying.
401784943577026560,2013-11-16 18:52:50,Felt that I needed to add more insight on the  'issues we can't fix' part of the article: http://t.co/Zo5zAwuCWI #Bukkit
401505991562248192,2013-11-16 00:24:22,More information on the Minecraft 1.7.2 update: http://t.co/EIbdZLEct7 #Bukkit
401370948554997760,2013-11-15 15:27:45,Getting closer to first @CraftBukkit 1.7.2 dev build. This update is one of the more complicated and larger updates we've had to work with.
400670073255641088,2013-11-13 17:02:44,"@jasbro1969 Sorry, I try my best to keep on top of the Google Group but sometimes forget. Felt it was too late to send old messages now..."
399589176955666432,2013-11-10 17:27:38,"While we will have @CraftBukkit dev builds, there are issues in Minecraft we can't fix that may prevent us from getting anything stable out."
399417211796086784,2013-11-10 06:04:18,"@VergilPrime at the top of our site and forums, http://t.co/r8YjxWdAUQ"
399247544355938304,2013-11-09 18:50:06,"Finally fixed our notice system, now we have a notice up about 1.7.2 that shows everywhere. Also got our twitter feed showing again. #Bukkit"
399247150913433601,2013-11-09 18:48:33,We're still working hard towards our first @CraftBukkit development build for Minecraft 1.7.2. Thanks for your patience &amp; continued support!
397128771343769600,2013-11-03 22:30:52,@TheNetTweets @MrGhettoCraft ...people even got mad when we hit 99% and it took too long to release something. Hurts more than it helps.
397128570688253953,2013-11-03 22:30:04,"@TheNetTweets @MrGhettoCraft yes because even if we hit 99%, it doesn't represent much. The update process is more than that."
396775994184699904,2013-11-02 23:09:03,"@MrGhettoCraft no, it didn't provide any real indication of the real progress made."
396740807707070464,2013-11-02 20:49:14,Wish I could provide more information but the best I can do is simply reassure everyone that we're working very hard on the update. #bukkit
395921837773033472,2013-10-31 14:34:56,This is probably one of the best Halloween secrets ever. @PrisonArchitect #spoilers http://t.co/VEfas14u5L
395698205541019648,2013-10-30 23:46:18,.@CraftBukkit 1.6.4-R2.0 Recommended Build is available! See http://t.co/xzKJyCGtG4 for info. Fixes custom world structure saving! #Bukkit
395577093196886016,2013-10-30 15:45:03,"We've fixed an issue with custom world structure saving, releasing 1.6.4-R2.0 soon so admins can properly save their structures. #Bukkit"
395262946395578368,2013-10-29 18:56:44,"I believe http://t.co/LbRRMjhCnW is up again, changelog generation might be down. Downloads should be fine. There is no 1.7 yet. #bukkit"
395234758697185281,2013-10-29 17:04:44,Like why we can't provide ETAs/status. I am always looking for ways to improve the project and hope you'll join me in the discussion.
395234426143391744,2013-10-29 17:03:24,"After 1.7, I'll be blogging about parts of the Bukkit project &amp; am willing to have an open discussion about how/why we do things"
