611202582434959360,2015-06-17 16:03:45,"All good points: Why F#, and Why Not Windows --&gt;http://t.co/yepLCkGsYs
via @adron"
611156422999547904,2015-06-17 13:00:20,I've settled on a design for my wedding cake. http://t.co/CeDgqx1aJO
611141281906061312,2015-06-17 12:00:10,"Fix your code, don’t disable static analysis --&gt; http://t.co/br2Q9lJhVl
via @DerikWhittaker"
611024895162486784,2015-06-17 04:17:41,@KF7PSC yeah I caught that too.. you can see it from the freeway lol
611013111127089152,2015-06-17 03:30:52,Going to see two of these next weekend: These 13 Hidden Waterfalls In Oregon Will Take Your Breath Away --&gt;http://t.co/3RYE6Ee3Lr
610945031780835328,2015-06-16 23:00:21,Nice! #RaspberryPi Official Enclosure from the Raspberry Pi Foundation --&gt; http://t.co/iGmYSEHAnz
610931057001689088,2015-06-16 22:04:49,RT @mikegstowe: Love #PHP and #APIs? Join us tonight at @sfphp as we talk about the #API Design First approach and tools like #RAML - http:…
610926011081977857,2015-06-16 21:44:46,Easily one of the best tools I've found this year: #nimbletext Get it now!--&gt; http://t.co/YmqdnhlX9F
610869548191981569,2015-06-16 18:00:24,What technical recruiters can learn from online dating --&gt; http://t.co/Z5VJvQV8CC
610867126476402690,2015-06-16 17:50:46,@drifterz28 That's funny. Probably because you follow me on Google+ too
610824804762025984,2015-06-16 15:02:36,Building a Raspberry Pi Motion Sensor with Realtime Alerts --&gt; http://t.co/s3h7ckvedI
610794037830938624,2015-06-16 13:00:21,"Cheap, Fast or Good. Pick any Two --&gt; http://t.co/0R2FMZI3Dz"
610573172086284289,2015-06-15 22:22:42,The Netflix Website Gets A Major Upgrade --&gt; http://t.co/nS86f7nIJK
610522295224913920,2015-06-15 19:00:32,Why Golang is doomed to succeed --&gt; http://t.co/V8epcTwG6h
610492271134420994,2015-06-15 17:01:14,Stanford study finds walking improves creativity --&gt; http://t.co/SSxYopzDpY
610478260560990209,2015-06-15 16:05:34,Are you making your visitors load an entire book of JavaScript per page? --&gt; http://t.co/hzWQS5PPVa
610241661575139328,2015-06-15 00:25:24,The Klickitat Valley. Love it out here. http://t.co/5CRFh74lIV
609968806509719552,2015-06-14 06:21:10,Our day's accomplishment. Who needs a gym membership? http://t.co/ReixbxuXCx
609613097054007296,2015-06-13 06:47:43,"@cmejet I know #ReactJS is gaining steam like @drifterz28 mentioned, and it has some really interesting patterns and ways of rendering..."
609480486277263360,2015-06-12 22:00:46,The rusting U.S. naval base being swallowed by the rainforest --&gt; http://t.co/80HF6d5IMC
609475056129847297,2015-06-12 21:39:11,"@drifterz28 yeah the article makes some good points, but not enough to sway me away from it."
609472654005768192,2015-06-12 21:29:38,"Photo from a friend of a truck fire on I-84 
#pdxtraffic http://t.co/SqRQmWMIXk"
609465877583376384,2015-06-12 21:02:43,RT @RogerBouG: Gateways can help the world move toward smart agriculture http://t.co/BXlwpJWclB via @inteliot #IoT #farming
609435036769722368,2015-06-12 19:00:10,I won't be using #Angular for my next project...and neither should you. --&gt; http://t.co/aIqyKOhyNU
609420043391266817,2015-06-12 18:00:35,Mastering the Arcane Art of JavaScript-mancy for C# Developers --&gt; http://t.co/hYJ0fVyIIm
609399406408957952,2015-06-12 16:38:35,"Coder, developer, programmer, software engineer: What's the difference? --&gt; http://t.co/tpeUQ4gi6K"
609230071967035392,2015-06-12 05:25:42,"@brandantl @DavidNemeyer Yeah, certainly worth a try"
609212853749350401,2015-06-12 04:17:17,"@brandantl @DavidNemeyer Maybe in rural areas, but in cities I don't know there would be much savings. But I really have no idea."
609212670395330560,2015-06-12 04:16:33,"@brandantl @DavidNemeyer That's a good idea, however I'm not so sure it could fly there and have someone set it up before fire gets there."
609211074689105921,2015-06-12 04:10:13,@PortlandPolice Bring back the tradition!
609210830517747712,2015-06-12 04:09:15,"@DavidNemeyer @brandantl I could see them being useful, for a fairly low cost. However I would hope people aren't too reliant on them."
609170276128047104,2015-06-12 01:28:06,Why cars went from boxy in the '80s to curvy in the '90s --&gt; http://t.co/Jzuc6X9t28
609169336582828032,2015-06-12 01:24:22,"RT @eevee: OPS: we should send out emails when X fails
DEVS: fuck email, it's full of noise, let's use slack
OPS: we should notify slack wh…"
609169138800459776,2015-06-12 01:23:35,"@JoshBazell Thanks for following! I love your books, hoping for more."
609135087834173440,2015-06-11 23:08:16,"@NinaMehlhaf Wow, that's pretty exciting!"
609048558415831041,2015-06-11 17:24:26,"What is code? If you don't know, you need to read this --&gt; http://t.co/hpQBFn3AFC"
608838819366862849,2015-06-11 03:31:00,@EvoHans I love that quote. So true. @JoshBazell's work is amazing. Hoping he keeps writing.
608687878454013952,2015-06-10 17:31:13,This is pretty awesome: Interactive Real-Time earthquake map via @Oregonian developer @mfriesen ---&gt; http://t.co/7k1Qv0WsI1
608681362946572289,2015-06-10 17:05:20,"Wait till you see the wrong PO numbers we give the finalists on ""Accounting Idol"" tonight! 
#BoringRealityShows"
608677660802162688,2015-06-10 16:50:37,"The Real Scrum Masters of Portland™
#BoringRealityShows"
608676218045489152,2015-06-10 16:44:53,"Who wants to marry a Software Engineer? 
#BoringRealityShows"
608497884741259265,2015-06-10 04:56:15,One of dads old blower scoops. These are the types of heirlooms we have in this family http://t.co/IHVmMLDsCo
608427543843205120,2015-06-10 00:16:45,My newest use for #VisualStudio Code is a lightweight editor to build console apps to test a concepts outside of VS http://t.co/YAEtnIvGsn
608418233465597953,2015-06-09 23:39:45,"RT @ForestGroveFire: We are working a small slow moving brush fire on NW Hillside Rd near Clapshaw Hill, no homes threatened http://t.co/yi…"
607941263904657409,2015-06-08 16:04:26,Making the Case for using F# with Tomas Petricek (Channel 9)  --&gt; http://t.co/9BZtgbYXmj via @dotnetkicks #fsharp
607661740977889280,2015-06-07 21:33:43,"RT @GastonFire: We are responding to a brush fire on Highway 47 just south of the Gaston City limits, it does not sound like any... http://…"
607441035703128064,2015-06-07 06:56:43,"@fayadfami Yes, definitely different skills. But believe it or not I'm not the only one. There are 3 very technical members of my department"
607235979045412865,2015-06-06 17:21:53,My first shift of the year for water patrol! #Boat11 #firefighting http://t.co/CKUKmuGMAD
606868369330044929,2015-06-05 17:01:08,"The Story Behind Meteor's Next Big Move --&gt; http://t.co/tFL02F6xAV
[ #JavaScript #MeteorJS ]"
606584010098245632,2015-06-04 22:11:12,Inversion of control using dependency injection in Web APIs using Unity Container and Bootstrapper --&gt; http://t.co/z0VfDEGwnt
606513325229383680,2015-06-04 17:30:19,Hi Jeremy! #tweetmonkey
606344248674222080,2015-06-04 06:18:28,What I'm watching in my bunk at the firehouse tonight. Huge surprise I'm sure! #Emergency still rules. http://t.co/mTWBi4W8zZ
606318953917317121,2015-06-04 04:37:58,RT @shanselman: 43 Tabs Open? You're a bad person. http://t.co/PWWHBeaFPd ;)
606272718166720512,2015-06-04 01:34:14,Nice: #Postgresql - Admin Commands Short List --&gt; http://t.co/fDtznrHz85
606228569862176769,2015-06-03 22:38:48,"RT @romero: Making Quake. Michael Abrash &amp; Adrian Carmack. Mike is formulating the Black Book in his mind... Feb 14, 1996. http://t.co/QNSw…"
606096864945934336,2015-06-03 13:55:27,The always entertaining @codefoster showing the #tweetmonkey #Iot demo at @PADNUG http://t.co/vpQNnn9zze
605933108668416001,2015-06-03 03:04:45,For (int I; I&lt; 10000; I++) { #tweetmonkey }
605931875715014657,2015-06-03 02:59:51,#tweetmonkey
605856460052897793,2015-06-02 22:00:11,Console.message - console messages for cool kids --&gt; http://t.co/cZ5n70hzV5
605847347365474305,2015-06-02 21:23:58,RT @bphogan: When you put the emphasis on “a degree” instead of on “learning and experience” people will get the degree however they can.
605826511413739520,2015-06-02 20:01:10,Hey Portland area #IoT enthusiasts! Let's talk Internet of things with @codefoster tonight! --&gt; http://t.co/Bft4Ph6NMS
605796314845036546,2015-06-02 18:01:11,The One Hiring Mistake You Didn’t Know You Were Making --&gt; http://t.co/1wMNgtBdvo
605782607880548353,2015-06-02 17:06:43,"Looking Forward: Microsoft: Support for Secure Shell (SSH)  --&gt; http://t.co/cZMQlIhZMs 
via @dotnetkicks"
605759388956041216,2015-06-02 15:34:27,@drifterz28 you should patent those
605759089591779329,2015-06-02 15:33:16,RT @cackerman1: Why C++17 is the new programming language for games http://t.co/rjh2BXL19r http://t.co/5cB4tpdHoP
605750809461178369,2015-06-02 15:00:21,"Using Node.js, Express and MongoDB (#MEAN stack) in an http://t.co/ZBF2PlK3zh MVC --&gt; application http://t.co/eTPcXK3ALG"
605728128024096769,2015-06-02 13:30:14,"Simple but great rules for life:

If it's not yours, don't take it. 
If it's not true, don't say it.
If it's not right, don't do it."
605589484751626240,2015-06-02 04:19:19,@DameDurdin I'll let you be the race car.
605589393215086592,2015-06-02 04:18:57,"@peteetchou Yeah, we found a couple leads. Bought the whole collection -1 at the Forest Grove ReStore, been searching for the missing one."
605589057410732032,2015-06-02 04:17:37,"Ok, I'll admit I am nervous about 6 earthquakes off the Oregon coast in the last 2 days. I'll really be nervous when they get a hashtag."
605587747592671232,2015-06-02 04:12:24,"Definitely excited to read this free ebook by @robertsjason ""Clean C#"" ---&gt; http://t.co/LTQT8MIqZb"
605557635916570625,2015-06-02 02:12:45,"Golden Book Encyclopedia of Natural Science, 1962. Any chance someone out there has #14 they'd like to sell? http://t.co/ql73pzlcq0"
605464034561916929,2015-06-01 20:00:49,"Why the Internet of Things will change everything --&gt; http://t.co/Ivqd1ota2M 
#IoT"
605454207433383936,2015-06-01 19:21:46,Just discovered console.log(JSON.stringify(object)); that sure makes debugging easier.
605433865226854402,2015-06-01 18:00:56,It’s a trap! Systems traps in software development --&gt; http://t.co/KTApWS9Sju
605403519642963968,2015-06-01 16:00:21,Is #ReactJS faster than #AngularJS ? --&gt; http://t.co/yYjeUjN2Hc
605395840744759297,2015-06-01 15:29:50,"Great advice: Why to avoid fat controllers --&gt; http://t.co/KNS1O9PYQ3 
via @dotnetkicks"
605358466107109376,2015-06-01 13:01:19,Common Code Smells --&gt; http://t.co/Z6o5yRSI0L
605238422656053248,2015-06-01 05:04:19,RT @jongalloway: Check out this @omnisharp refactoring magic that @JasonImison is cooking up! https://t.co/Ie4E04YslT
605238101502365697,2015-06-01 05:03:02,@ShawnWildermuth good riddance. It's sad what they've become
605161809230753794,2015-05-31 23:59:53,"@jonelf that does seem amazingly long, especially if it's IDE"
605142701307084800,2015-05-31 22:43:57,@jonelf that's awesome
605141967450701824,2015-05-31 22:41:02,@jonelf awesome! What OS?
605140900444934146,2015-05-31 22:36:48,@jonelf good way of looking at it! Though I do have my PowerBook from 2003 in the same garage
605140660660764673,2015-05-31 22:35:51,"@d0gma I was 25. I got old, it'll happen to you too"
605118669845204992,2015-05-31 21:08:28,I originally purchased this kit in 2002. Finally assembled it today. Talk about procrastinating. http://t.co/jbKLsNeSGY
605088013010509824,2015-05-31 19:06:38,Dont Build El Caminos --&gt; http://t.co/Z7CYdDpjux
604846666798252033,2015-05-31 03:07:37,"Drag and drop bootstrap tabs in http://t.co/ZBF2PlK3zh 5 with Angular --&gt; http://t.co/4TR2HWGqEV
via @dotnetkicks"
604776637729779712,2015-05-30 22:29:21,A brief introduction to REST services --&gt; https://t.co/iWJecmp5r3
604737419615674368,2015-05-30 19:53:30,"@ChadGracia Your documentary looks excellent. Any chance it will screen anywhere near Portland, OR? I couldn't find any information"
604336909658116096,2015-05-29 17:22:01,"Yeah... about that. 

#JustDeveloperThings http://t.co/2B76nkyQTR"
604271000763650048,2015-05-29 13:00:08,"Sorry, I don't have a clever lie for why that happens."
604091291627057152,2015-05-29 01:06:02,"Radio hams do battle with ""The Russian Woodpecker"" --&gt; http://t.co/6D8BrzAlNR"
604072116263116800,2015-05-28 23:49:50,I love automation. I work very hard to be this lazy.
603978445106720768,2015-05-28 17:37:37,RT @911_redhead: You can tell who has military or police background by how they make up the gurney.
603707565567025152,2015-05-27 23:41:14,RT @EvoHans: What happens when you park in front of a fire hydrant in my town. - #Pics http://t.co/N0eEm2zxbB
603629126524792832,2015-05-27 18:29:33,"@micahgodbolt @klamping @spaceninja I prefer A, as long as there isn't excessive nesting."
603576764988837888,2015-05-27 15:01:29,An interactive map showing every German bomb dropped on London during WW2 Blitz --&gt; http://t.co/hHg9BddbXg
603420556826910721,2015-05-27 04:40:46,The State of #GoLang --&gt; http://t.co/hbXYFPz2mc
603415290819391488,2015-05-27 04:19:50,@iamdevloper You could say there are two types of frameworks.  The ones people complain about and the ones nobody uses.
603414844541272064,2015-05-27 04:18:04,RT @iamdevloper: I guess that’s another way to rank JavaScript frameworks… http://t.co/u9MpucaegI
603331784055521280,2015-05-26 22:48:01,"Great advice, I'll have to try this out. http://t.co/cp5sbE8q68"
603310020453793792,2015-05-26 21:21:32,@peteetchou @SLTrLsn Ha! Could be! Did you experience any loss of water?
603292524082429952,2015-05-26 20:12:01,"4 alarms at once in Cornelius, indicating water flow issue. Likely a construction accident with water supply #FireCom http://t.co/wzl0kLMOSK"
603286022693191680,2015-05-26 19:46:10,On being overwhelmed with our fast paced industry --&gt; http://t.co/CL8d0mP2Zr
603279715814744064,2015-05-26 19:21:07,Why investors don't fund dating --&gt; http://t.co/AibWm2Q4T2
603227944715071488,2015-05-26 15:55:24,Me and the amazing @AaGilley having a family fun day yesterday http://t.co/WfWFEsx1R2
603218714599776256,2015-05-26 15:18:43,"WCF for DNX Core a waste of time? #wcf #dnxcore --&gt; http://t.co/msHNAkET4D 
via @dotnetkicks"
601790964043259904,2015-05-22 16:45:21,Seven Things Your IT Department Wishes You Knew About Tech Support --&gt; http://t.co/tbkNXfNwja
601572687819845633,2015-05-22 02:18:00,There's about an inch of standing water on Baseline in Cornelius. Drive safely if you have to. #pdxtraffic
601519849916014592,2015-05-21 22:48:02,How Eddie Van Halen Hacks a Guitar --&gt; http://t.co/1B38stBtNC
601454357859602432,2015-05-21 18:27:48,RT @WCSheriff: Driver rcvd warning – NO driving w/ a human under the hood to hold battery cable at 45mph &amp; a ride from @AAA_Travel http://t…
601372037303664640,2015-05-21 13:00:41,"DNVM, DNX, and DNU - Understanding the #aspnet5 Runtime Options --&gt; http://t.co/djUaHI4DuN"
601138504609964032,2015-05-20 21:32:42,.NET Foundation - WCF is Open Source --&gt; http://t.co/pWIXOmvuHM
600801510839164928,2015-05-19 23:13:37,Why you’ll NEVER nail that #DevOps interview --&gt; http://t.co/Xr7RBpbLFh
600735102075850752,2015-05-19 18:49:44,Five Best To-Do List Managers --&gt; http://t.co/uOnA52TWlK
600707594622259200,2015-05-19 17:00:25,RadioShack Sold Your Data to Pay Off Its Debts. The FTC Isn’t Too Happy About It. --&gt; http://t.co/gKGvG0WgoK
600688094308913152,2015-05-19 15:42:56,"Great article about C# Finalizer myths: When everything you know is wrong, part one --&gt; http://t.co/pYafWhLUV2"
600408368247779328,2015-05-18 21:11:24,RT @shanselman: No footage of the mother of one of these bikers smacking him around for hanging out with a bad influence?
600330919032029185,2015-05-18 16:03:39,Google introduces Preemptible VMs  --&gt;http://t.co/civ2cLH3NS
599823838512287744,2015-05-17 06:28:41,Kore is an easy to use web application framework for writing scalable web APIs in C --&gt;  http://t.co/NBmWLZDJhe
599354318983188480,2015-05-15 23:22:59,Announcing Rust 1.0 --&gt; http://t.co/o7tDDqDfRm
599335994228404224,2015-05-15 22:10:10,"Tynker, A Startup That Teaches Kids To Code, Now Works With Robots, Drones And More --&gt; http://t.co/U1FjO2BXlD"
599097210450489344,2015-05-15 06:21:20,"@kenhowardpdx And I totally missed the TypeScript meetup tonight for some family time, but maybe I'll see you at the next one!"
599097065868632064,2015-05-15 06:20:45,@kenhowardpdx At this point I'm mostly playing around with it. The little front end stuff I do is usually Angular. I do mostly backend stuff
599050622785040384,2015-05-15 03:16:12,@brandantl I still can't get pulse point to send all the push notifications.
599021331779178497,2015-05-15 01:19:49,"RT @DMiller29649: How to set the #Mean stack w/ #DigitalOcean...
https://t.co/3L4sj6sOMx"
598886425346449409,2015-05-14 16:23:45,@jcapellman definitely know that feeling! Actually I rewrote this particular piece in my head this morning on the drive to work :)
598880430453030912,2015-05-14 15:59:55,"This is almost a daily occurrence. Don't pretend like you don't do the same thing.
#JustDeveloperThings http://t.co/Yq4wquwVxY"
598529130196561920,2015-05-13 16:43:59,"What JS libraries are first on your list for new projects? #javascript --&gt; http://t.co/DVchMe9Z7S 
via @javascriptkicks"
598369986508296192,2015-05-13 06:11:36,"TIL the version of ""I want you to want me"" you usually hear is not the album version, but a concert recording that was more successful"
598259432586371072,2015-05-12 22:52:18,Architecting Websites For The HTTP/2 Era --&gt; http://t.co/SGXWela04z
598207265028485121,2015-05-12 19:25:00,RT @dotnetkicks: Solution to Little Puzzlers-Positive Integer to Roman Numerals by @BlkRabbitCoder https://t.co/8gKBT7bEw4 #csharp via @Dot…
597889656462663680,2015-05-11 22:22:57,Tutorial: How to connect to #MySQL with #Python --&gt; http://t.co/6bmNc0F35l
597864301853028352,2015-05-11 20:42:12,"Though I disagree with it, I can see where the author is coming from: Programming is not a craft --&gt; http://t.co/G1teq3eypI"
597829301476597760,2015-05-11 18:23:07,RT @google: Our self-driving cars have logged nearly 1M miles on the road without causing an accident → https://t.co/IT7CwUMigB http://t.co…
597817011469582336,2015-05-11 17:34:17,"Opinions expressed here are my own, and do not represent the opinions of Adventure Works Cycles or Contoso Ltd."
597789967490887680,2015-05-11 15:46:49,"Mono 4.0 Released with C# 6  --&gt; http://t.co/R8KJVSyePz 
via @dotnetkicks"
597659114831937536,2015-05-11 07:06:51,@puppetmasterd @GeekAndDad that could be too. I haven't tried the apple watch biometrics yet
597658904877600769,2015-05-11 07:06:01,@puppetmasterd @GeekAndDad in other words your cardio is probably so good your HR isn't high enough.
597658608550092800,2015-05-11 07:04:50,@puppetmasterd @GeekAndDad it's probably a threshold issue. For Fitbit it's really high before it's considered exercise (150 Bpm)
597465967828959233,2015-05-10 18:19:21,"Since I couldn't find the name of the @oz_code wizard, my daughter has decided his name is ""Oswald"" http://t.co/rMvOxsS2Gn"
597400848021508097,2015-05-10 14:00:35,Use this as a handy checklist before you push code to ready for test --&gt;  http://t.co/r9yucBUNsd
597146731894026240,2015-05-09 21:10:49,New home construction is so fun in washco. For some things you can only get general info then they tell you the rules after you fail code.
597145877866618880,2015-05-09 21:07:26,Any of my construction friends happen to know the code for crawl space vent placement in Washington county? http://t.co/AxBS2TuL8d
596732010359468033,2015-05-08 17:42:52,What a great warning sign. http://t.co/jVGv9QBCXV
596429473848946688,2015-05-07 21:40:42,NASA's Radar Found 4 Men Trapped in Rubble in Nepal By Their Heartbeats --&gt; http://t.co/j0IZ5zOE35
596413241217130496,2015-05-07 20:36:12,go-bootstrap: Generates a lean and mean Go web project in #GoLang --&gt; http://t.co/NXT8albY6R
596403574193704961,2015-05-07 19:57:47,The Top 6 Tech Skills You Need in 2015 --&gt; http://t.co/F1hLExjR51
596364527291265025,2015-05-07 17:22:37,How the Freightliner Reveal Was Projected onto the Hoover Dam --&gt;  http://t.co/yV7KecyJ6q
596084263189086211,2015-05-06 22:48:57,"Introducing The Microsoft Edge Dev Blog --&gt;  http://t.co/37sYVYojnW
via @dotnetkicks"
595987259872006144,2015-05-06 16:23:30,@paulcbetts @HumanCompiler Great point. Your happiness depends on what you focus on.
595986921878265857,2015-05-06 16:22:09,"RT @paulcbetts: Dear Developers,

It's so easy to find things that suck and rant about them, but **so** much better to look for things to b…"
595687719273156609,2015-05-05 20:33:14,"So @henrystavern followed me, I think that's a sign that I need to go back.. it's been too long"
595686964445208577,2015-05-05 20:30:14,@adron type or whereis
595621880758968320,2015-05-05 16:11:37,"RT @brog45: Surely these are the end of days. This is like the zeroth seal of the apocalypse, right? https://t.co/8gFq7asSlS"
595620706064400384,2015-05-05 16:06:57,@micahgodbolt Definitely! They seem to have a lot of parking lot items
595617316500561920,2015-05-05 15:53:28,Saw a bunch of smashed cars in the lot next to an auto body shop and my first thought was: wow what a huge backlog. #JustDeveloperThings
595472743887310848,2015-05-05 06:19:00,@u2elan @KATUNews Blurry people misbehaving of course.
595420333202636800,2015-05-05 02:50:44,Setting up Windows 10 for IoT on your Raspberry Pi 2 --&gt; http://t.co/C51UJrqRnm
595367948132294656,2015-05-04 23:22:34,"@julielerman thanks for writing it. It was laid out pretty clearly, and there is a lot of confusion coming into  5 due to the big changes"
595336888921165824,2015-05-04 21:19:09,@brandantl yeah took me a minute too
595286951495868416,2015-05-04 18:00:43,Can't you make your code less complex? http--&gt; ://buff.ly/1zIiQ3O
595271918883835904,2015-05-04 17:00:59,"The EF6, EF7 and ASP .Net 5 soup --&gt; http://t.co/sxvDiiy0q2 &lt;-- 
Great read via @julielerman"
595249615743520768,2015-05-04 15:32:22,RT @angeloseminary: Join me at @PADNUG on Tuesday as my friend Bill Bartlett is presenting on Two Factor Authentication http://t.co/hBhCBHS…
595069430117355520,2015-05-04 03:36:22,Common C#/.Net Interview Questions  --&gt; http://t.co/me9U70Xpt5 via @dotnetkicks
595040950251991040,2015-05-04 01:43:12,Well that's good news for #SEO http://t.co/7rGtqEAECh
594594274789826560,2015-05-02 20:08:16,"RT @timsneath: Dear #Build2015 friends, sorry I missed you yesterday. Was busy becoming an American citizen. See you today! #bldwin http://…"
594276631344189440,2015-05-01 23:06:04,"To invent the future, you must understand the past --&gt; http://t.co/olUcgCclan"
594167023426543617,2015-05-01 15:50:32,"Microsoft brings Windows 10 to Makers --&gt; http://t.co/ranFRVd5rv 
via @dotnetkicks #RaspberryPi2"
593903497210437633,2015-04-30 22:23:22,Announcing our book: “Hack &amp; HHVM” --&gt; http://t.co/ge17lfHoNy
593884696410357760,2015-04-30 21:08:40,"@mcconnellj Yep, those are terrible. Forward compatibility can be impossible, backward compatibility not so much."
593874440473088000,2015-04-30 20:27:54,"@mcconnellj It absolutely is, and enterprise projects can get to a point where they'll only build in one version, for eternity."
593872648200826880,2015-04-30 20:20:47,It's like an evolution of #VisualStudio icons on my taskbar. http://t.co/GMlG2ZVArp
593867536145453056,2015-04-30 20:00:28,Improving the GitHub workflow for the Microsoft Community --&gt; http://t.co/K2TA2Jy5Eg
593845879393640448,2015-04-30 18:34:25,Microsoft makes it easier to build Minecraft Mods using Visual Studio --&gt; http://t.co/6LslX1FLJu
593820726844628992,2015-04-30 16:54:28,7 Ways to Manage Windows Processes Remotely --&gt; http://t.co/LhOxghJ0Yx
593761987445817345,2015-04-30 13:01:04,"I'll admit it, I never thought I'd see the day. #VisualStudio on #ArchLinux great things ahead. 
#bldwin #build2015 http://t.co/Zdyrc6dfqO"
593656226803621889,2015-04-30 06:00:48,"""Hey, can you give me a hand up here in the attic?"" ""Look around; there should be one up there already"" --&gt; http://t.co/syeF3sn2Sz"
593643669783060480,2015-04-30 05:10:54,@adron @browniefed This is a really cool idea!
593619617618202625,2015-04-30 03:35:20,"Introducing Visual Studio Code, 2015 RC, Insights .NET Core Preview for Linux and Mac  --&gt; http://t.co/MijffS2mct
via @dotnetkicks #bldwin"
593572387431387137,2015-04-30 00:27:39,Future #FireFighters packed up and ready. http://t.co/SVoCE5Jk9L
593552009388826625,2015-04-29 23:06:41,"Microsoft Announces Continuum, Turning Windows 10 Phones Into Desktops --&gt; http://t.co/Wm3PdU2Zu6"
593527801166176256,2015-04-29 21:30:29,Microsoft Launches Its .NET Distribution For Linux And Mac --&gt; http://t.co/SJ8kFkxc5p
593520162889801729,2015-04-29 21:00:08,"Microsoft Launches Visual Studio Code, A Free Cross-Platform Code Editor For OS X, Linux And Windows --&gt; http://t.co/JFSKgQO6GB"
593513465228079104,2015-04-29 20:33:31,"RT @ActiveNick: Meanwhile, in Cupertino: Tim Cook ""Wait, wait, can they do that???"" #bldwin"
593507702443147265,2015-04-29 20:10:37,"Microsoft used this adorable robot to show off new HoloLens features --&gt; http://t.co/NMNGS3LQyW
#bldwin"
593505370330431489,2015-04-29 20:01:21,@shiftkey @github @scottgu that is awesome. I have got to get my hands on some of those!
593505178759757824,2015-04-29 20:00:36,The 2048 guys stole my iPhone game --&gt; http://t.co/uGwSDfA0Ha
593504239185342465,2015-04-29 19:56:52,@joshua_carroll It's a great time to be a .Net developer!
593504069307666432,2015-04-29 19:56:11,@shiftkey @github Is that an Octocat in a @scottgu uniform?
593503670987194368,2015-04-29 19:54:36,RT @Raspberry_Pi: Amazing demo at #build2015 #bldwin - a Raspberry Pi robot working with #HoloLens. We’re dying with happiness. http://t.co…
