431672923389456384,2014-02-07 06:16:59,Angular is (relatively) easy! Here's a quick calculator app to show how easy and organized Angular can be. http://t.co/kvmdIgkeit
431657364727406593,2014-02-07 05:15:10,"@jeannav01 @pdxcommute I bet! I actually did pretty well, however I did see tons of cars on the sides of the freeways."
431657098263289856,2014-02-07 05:14:06,@drifterz28 yeah yeah yeah rub it in lol
431622013808279552,2014-02-07 02:54:41,Woman describes 'chaos' at Murray Hill intersection in Beaverton --&gt; http://t.co/EQpL2dSWG2  #PDXTraffic
431603893584158721,2014-02-07 01:42:41,RT @KATUNews: #Liveonk2 RT @JamesJohnson023 Meanwhile in aloha http://t.co/i9v9ccubnC
431595192643104769,2014-02-07 01:08:07,Drive all the way from Beaverton and where do I get stuck? My own driveway! http://t.co/7wHn2aX07h
431551513216184320,2014-02-06 22:14:33,One killed in 27 car pile up on I-5 crash near Ridgefield --&gt; http://t.co/9pwvIEt4pq
431535737528672256,2014-02-06 21:11:52,"How do I ""think in AngularJS"" if I have a jQuery background? --&gt; http://t.co/6E5VkHO17H"
431534294369316864,2014-02-06 21:06:07,12 Benefits of Golang For Enterprise Systems --&gt; http://t.co/hsuenCril8
431488100485705728,2014-02-06 18:02:34,RT @AshleyKorslien: I'm going to venture away from our live truck and try to get closer pics from the wreck scene. #kgwweather @KGWNews htt…
431483919259549696,2014-02-06 17:45:57,RT @KATUNick: Breaking: I-5 South CLOSED North of Albany due to 20 car pile-up. #liveonk2 #pdxtraffic
431483380799397888,2014-02-06 17:43:49,"Here's a video of I-5 North of Albany. Slick, crazy conditions, stay safe out there! --&gt; http://t.co/T66lQBYhQH  [ #pdxtraffic ]"
431451406206529536,2014-02-06 15:36:45,"High-level IT consultant on Cover Oregon: ""They didn't know what they were doing"" --&gt;  http://t.co/DwZwtARYTH"
431283015491149824,2014-02-06 04:27:38,And now I'm off to use Screenflick to make some videos!
431282556915298304,2014-02-06 04:25:49,"The old shareware model... @AraeliumGroup gets it right. I downloaded their product, tried it, liked it, bought it. 15 mins total time."
431078126018654208,2014-02-05 14:53:28,Microsoft Employees Fondly Remember Days When CEOs Were So Big They Took Up Entire Rooms --&gt; http://t.co/lqNprxawp5
430891054100152320,2014-02-05 02:30:07,Meet the chaplains! (@ Luis Palau Association) http://t.co/n9G2skASGX
430887147919654912,2014-02-05 02:14:36,MVA on Cornell &amp; Wallbridge Hillsboro. #pdxtraffic http://t.co/QOGcssN1td
430769965168590848,2014-02-04 18:28:57,Orchestrate launches with a database API for the new enterprise stack --&gt; http://t.co/A2xBccN3kk
430723261169926144,2014-02-04 15:23:22,A new era begins: Satya Nadella named Microsoft's 3rd CEO --&gt; http://t.co/ijge5j5X6n
430447098178584576,2014-02-03 21:06:00,Paper and the craft of securing Facebook's future --&gt; http://t.co/1YGUzxoIjN
430180537630613504,2014-02-03 03:26:47,I guess that uniform dad bought me back in 1986 finally paid off for them. #GoHawks http://t.co/pTqNpHHyOx
429962732725891072,2014-02-02 13:01:18,Learn You The Node.js --&gt; http://t.co/9l11xrxQC6
429917360573931520,2014-02-02 10:01:00,10 ways to get more productive in Visual Studio --&gt; http://t.co/80ZQVk55Wj
429807404193415169,2014-02-02 02:44:05,We Are Giving Ourselves Cancer --&gt; http://t.co/44rsziers2
429751829132374016,2014-02-01 23:03:15,"@hhariri haha ""Windows ME 2014"". It's not nearly as bad as I remember ME being though. Performance and stability of 8.1 is great."
429746054444351489,2014-02-01 22:40:18,"It's actually cool on the Surface, but..  Microsoft backs off on Metro --&gt; http://t.co/7NClXP4VNj"
429376294762328064,2014-01-31 22:11:00,This is awesome. Progress in the right direction for the fire service. Phoenix Appoints First Female Fire Chief --&gt; http://t.co/loLU4nN9ql
429359937735892992,2014-01-31 21:06:00,Why not use polling threads with http://t.co/ZBF2PlK3zh web applications? --&gt; Programming Blog http://t.co/dIoDi6Eg3g
429297718486634496,2014-01-31 16:58:46,"I examined last years traffic stats for http://t.co/pBn17Q02DH, and this is what I've found --&gt; http://t.co/f7x7tXjhYz"
429297293863694337,2014-01-31 16:57:05,"""Happiness is not something you postpone for the future; it is something you design for the present."" - Jim Rohn"
429259553587613696,2014-01-31 14:27:07,This 17-Year-Old Dropped Out Of High School For Peter Thiel And Built A Game-Changing New Kind Of Computer --&gt; http://t.co/5iyslEoQtd
429192618942410752,2014-01-31 10:01:09,Importance of Software Maintenance --&gt; http://t.co/IfEOA8yfGF
428731224459603969,2014-01-30 03:27:44,Wow. Man survives going through wood chipper --&gt; http://t.co/ocpgY1Rtwl
428264508398637056,2014-01-28 20:33:10,"On Tue, 13 May 2014 16:53:20 GMT The Unix timestamp turns 1400000000!

Shall we throw a party?"
427847749846204416,2014-01-27 16:57:07,Cisco says Java Primary Cause of 91 Percent of Attacks --&gt; http://t.co/bUqVJYVEpi
427825424203530240,2014-01-27 15:28:24,PHP on steroids: HHVM with Symfony 2 looks amazing --&gt; http://t.co/AKVAWuxNYJ
427623011014152192,2014-01-27 02:04:05,"Intel To Cut 5,300 Jobs in 2014 --&gt; http://t.co/jfnSKrLhbu"
427548021476564992,2014-01-26 21:06:06,Rapid Object Detection in .NET --&gt; http://t.co/1HZCLCCGB6
427498095669039104,2014-01-26 17:47:43,".@brandantl Visual Studio Online also includes a lot of workflow / TFS stuff. I like TFS in the cloud, but online VS not so much."
427490997711691776,2014-01-26 17:19:30,Longing for the old days when you purchased software and waited over a week for it? Buy an OS from Apple! http://t.co/sBYB564nd7
427298757533646848,2014-01-26 04:35:37,Great Point. http://t.co/qrps8psGYO
427142757656711168,2014-01-25 18:15:44,@brandantl how do you like it so far?
427018263051374593,2014-01-25 10:01:02,Rethinking the limits on relational databases --&gt; http://t.co/URtxfxi68u
426975394261401600,2014-01-25 07:10:41,Microsoft reduces price on Azure storage --&gt; http://t.co/zDfupPMiLS
426856997305454592,2014-01-24 23:20:13,A study on what every programmer knows: The High Cost of Interruptions --&gt; http://t.co/ee4x2KmFB1
426823251416064000,2014-01-24 21:06:07,Why You Should Use Continuous Integration and Continuous Deployment --&gt;  http://t.co/VWQRhpue9S
426797719521198080,2014-01-24 19:24:40,Of course Gmail has to go down when I'm right in the middle of a business negotiation with the Prince of Nigeria.
426738692368396289,2014-01-24 15:30:07,Use Subqueries to Count Distinct 50X Faster --&gt; http://t.co/ipnT1vkc4j
426583650084208640,2014-01-24 05:14:02,@brandantl I can't say much about the compiler but the tooling of the IDE has changed drastically in 2013. Tons of time saver stuff.
426582641203093504,2014-01-24 05:10:01,@brandantl Really? Like which ones? I usually don't run into them unless I'm trying to do something a little crazy with the strict types
426582154370236416,2014-01-24 05:08:05,.@richcampbell @carlfranklin awesome show tonight guys! Entertaining as always but was cool to see it done live.
426581638080761859,2014-01-24 05:06:02,".@ShawnWildermuth Nice show, was really cool meeting you tonight, and nice to chat with you! Hope you come back around soon!"
426581116439367680,2014-01-24 05:03:58,@JamesMontemagno Fantastic talk today. Your demo has convinced me to finally purchase @xamarinhq and get started!
426501884778524672,2014-01-23 23:49:08,It's #dotnetrocks being recorded live! http://t.co/CGIYhJsnJ3
426480690301898752,2014-01-23 22:24:54,Woop woop!  #modernapps2013 http://t.co/wICP5NUrg3
426450328616452096,2014-01-23 20:24:16,Visual Studio launch party! (@ Cinetopia w/ 3 others) http://t.co/6TIhTedtf6
426431200320704512,2014-01-23 19:08:15,I'm at the DMV today and there are only three people ahead of me. Clearly I haven't woken up yet today.
426293487576047616,2014-01-23 10:01:02,"Wow: Network Solutions Auto-Enroll: $1,850 --&gt; http://t.co/7PGqBQpQUI &lt;-- apparently @netsolcares  about money!"
426232394660577280,2014-01-23 05:58:16,@hillsbjp Yes! used to prevent insurance fraud and give us cool stuff to watch on YouTube!
426231514767302656,2014-01-23 05:54:46,16 Things Russians Do That Americans Might Find Weird --&gt; http://t.co/MJVPhH17Xr
426223474198077440,2014-01-23 05:22:49,"RT @hipsterhacker: I don't know what I'm writing yet, but I know it's going to compile to Javascript."
426221866714267649,2014-01-23 05:16:26,@anotheruiguy @mturnwall That mask looks great. I'm with you and other firefighters who think the Google Glass will probably be too fragile.
426098447243304960,2014-01-22 21:06:01,Fire inside Houston Walmart. Bystanders Get Video Instead of Getting Out --&gt; http://t.co/yrKV8j771d
426070053142794240,2014-01-22 19:13:11,.@shanselman Happy 40th Scott. Did you order that shiny red Corvette yet?
426038919465934848,2014-01-22 17:09:28,I can smell the Beaverton car fire from about a mile away.  #firecom
426035783620104192,2014-01-22 16:57:00,"Taking PHP Seriously, or How Facebook almost reinvented #PHP through HHVM --&gt;   http://t.co/Cf8AwO2HKc"
426012069365043200,2014-01-22 15:22:46,"Announcing the Release of http://t.co/ZBF2PlK3zh MVC 5.1, Web API 2.1 and http://t.co/ZBF2PlK3zh Web Pages 3.1 --&gt; http://t.co/1HuUje20RI"
425931130404360192,2014-01-22 10:01:09,10 Programming Languages You Should Learn in 2014 --&gt; http://t.co/tLjPGBOSBy
425866930285604864,2014-01-22 05:46:03,"At times @Pluralsight is like a replacement for cable TV for me. Is that sad, or awesome? Hard to say."
425857675474128896,2014-01-22 05:09:16,"@MattJohnstonFG Yep, I could definitely see crunching those glasses inside a mask. Not to mention how much moisture is in there."
425853722044796928,2014-01-22 04:53:33,"@hhariri Definitely. Looking from a developer POV, it would take a lot to get it working nationwide. Cool that this guy is working on it"
425853426279256065,2014-01-22 04:52:23,@MattJohnstonFG Definitely. If done right it could change firefighting and EMS drastically. Cool stuff.
425850214302613505,2014-01-22 04:39:37,I take back everything I've said about Google Glass. This looks like an awesome application for it --&gt; http://t.co/yMhyGchFKF
425758266325364736,2014-01-21 22:34:15,"@BenoitMurray haha yeah, I have nothing to complain about that's for sure."
425736056936624128,2014-01-21 21:06:00,Dealing With Workaholism On Web Teams --&gt; http://t.co/gRvAHNWtnk
425725245690224640,2014-01-21 20:23:02,Top 10 ways to ensure your best people will quit | Articles | Main http://t.co/nqvPDcD5Rx
425673404780658688,2014-01-21 16:57:02,The decay and fall of guest blogging for SEO --&gt; http://t.co/G5Re2zTt6m
425633394505306112,2014-01-21 14:18:03,"If You Are a Richard Sherman Hater, This Video Will Change Your Mind --&gt; http://t.co/FyBiakVEyv"
425628714437599232,2014-01-21 13:59:27,Cold and frosty #pdxtraffic http://t.co/PUiMRFo3DW
425516084406390784,2014-01-21 06:31:54,@jeresig having haters means you've done something. Let them expend negative energy while you make the web better. Who really wins then?
425515568800620545,2014-01-21 06:29:51,@csells @jeresig haha Chris you're never shy with words.
425514666970734593,2014-01-21 06:26:17,"Those of you still calling @RSherman_25 a ""Thug"" should do some research. Look at his life. He's a role model. With intensity."
425483929333039104,2014-01-21 04:24:08,"Flu kills Sacramento woman in Korea, family raising money to bring her home --&gt;  http://t.co/BglWgy3biL"
425398731857354752,2014-01-20 22:45:35,"Join me for the Visual Studio Launch 2014 ""Modern App Development Leveraging the Cloud"" with the .Net Rocks Crew --&gt; http://t.co/EtnO008CIq"
425284665592004608,2014-01-20 15:12:20,95% of ATM machines still use Windows XP --&gt; http://t.co/QzOVDaJz7x
425133862763507712,2014-01-20 05:13:06,RT @DCBeerBill: Trying to imagine Richard Sherman during a traffic stop. DONT TALK TO ME ABOUT NEEDING TWO HEADLIGHTS.
424634669322092544,2014-01-18 20:09:29,I can't say enough how awesome it is to build ASP .Net websites these days. They've come a long way the last few years.
424481545928572928,2014-01-18 10:01:01,Threading in C# - Free E-book --&gt;  http://t.co/vnkCwhRyPI
424286530904293376,2014-01-17 21:06:06,Intel's Reccomended Reading List for Developers --&gt; http://t.co/31MnkCI1aY
424243840187637760,2014-01-17 18:16:28,New Features in PHP 5.6 - SitePoint --&gt; http://t.co/95nmNGPiFX
424030522541895680,2014-01-17 04:08:49,Learn more about UTF-8 than you ever thought possible: UTF-8 Everywhere --&gt; http://t.co/78ZRci5wnR
423897624685850624,2014-01-16 19:20:44,TypeScript: A New Language for .NET and JavaScript Developers --&gt;  http://t.co/qbiKc14G8t
423867596497104897,2014-01-16 17:21:24,"@malteo Yeah someone else just pointed that out to me. I thought it was appended to the end, but after looking it up It's wrong!"
423860796251455488,2014-01-16 16:54:23,My Fizz Buzz in F# - Because why not. It's the new Hello World --&gt; http://t.co/Bjhxb0n8OC
423719766805581824,2014-01-16 07:33:59,"Currently profiling straight text serving from my webhost, github, Azure and AWS. The results may be surprising."
423704229572669440,2014-01-16 06:32:15,@adron Love me some Bootstrap. It's great for CSS challenged folks like myself to save tons of time :)
423566083853791232,2014-01-15 21:23:18,@rollinsummers yeah I did it like crazy years ago. It's been at least 4 or 5 since I've done it that way
423565730404003840,2014-01-15 21:21:54,@isaac32767 yeah most likely. I'd love to try it!
423561743693279232,2014-01-15 21:06:03,List of 319 Twitter Bootstrap Resources --&gt;  http://t.co/jsCy9l1T0c
423499087804387328,2014-01-15 16:57:05,18 Essential Bootstrap UI Editors --&gt; http://t.co/fbeFgBH56G
423479526992404480,2014-01-15 15:39:21,Why You Should Be Freaking Out About The End Of Net Neutrality --&gt;  http://t.co/vTQAwzguP6
423471859099639808,2014-01-15 15:08:53,"@isaac32767 That part confused me as well. Is it because there is no continuous path, or is it a time issue? It's not very clear"
423296954093694976,2014-01-15 03:33:52,"Finally got around to installing / trying #Umbraco . So far, I really, really like what I see."
423272678540070912,2014-01-15 01:57:25,"New Twitter design, while it may be flat and modern... is rather hideous. I said it."
423258755716096000,2014-01-15 01:02:05,Amazing: A Janitor Secretly Worked On This For 7 Years. No One Knew Til Now... And It's Baffling Everyone --&gt; http://t.co/dpcKjA0yVn
423209818686357504,2014-01-14 21:47:38,@codinghorror Hmm.. SO for relationships and dating? Sounds like someone's trying to load test their network.
423161177561391104,2014-01-14 18:34:21,PSD to HTML is Dead --&gt;  http://t.co/Yk9FU1PjQD
423126065507487744,2014-01-14 16:14:49,"Microsoft Threshold coming in April 2015, Windows 8.1 dubbed as the new Vista --&gt; http://t.co/89ZlHUynS9"
422960677943508992,2014-01-14 05:17:38,How I Built a Raspberry Pi Tablet --&gt; http://t.co/1yIz0OeuNh
422739862958374913,2014-01-13 14:40:12,First project completed for my Spam Blocker Tools. Stuff to help people SPAM on their sites ---&gt; http://t.co/nGG0DrNMIH
422202837590745088,2014-01-12 03:06:15,"@isaac32767 yeah, it's mostly a list of tech inclined people in PDX, so it kinda fits :)"
421413449458253825,2014-01-09 22:49:30,Fascinating Graphs Show How Reddit Got Huge by Going Mainstream--&gt; http://t.co/Kn2OIJ2xNw
421363348417302528,2014-01-09 19:30:25,"Very interesting. Smart use of REST, and I was suprised to see a .Net backend! --&gt; http://t.co/D03erI8kGJ"
421325106741534720,2014-01-09 16:58:27,Software in 2014 --&gt; http://t.co/5r67YmcgyG
421157243849936896,2014-01-09 05:51:26,@KF7PSC Is that Roy Desoto on the left?
421030487180599296,2014-01-08 21:27:45,"@deanmau5 Thanks. I totally did it too. We all start somewhere, right?"
420998707224391680,2014-01-08 19:21:28,"@deanmau5 It's not always bad thing, it could be a trivial function and sometimes you just have to get a job done."
420998429427236864,2014-01-08 19:20:22,@deanmau5 yeah I think it's natural in the beginning. Swiping stuff from Stack Overflow or tutorials without understanding it fully.
420777106935922689,2014-01-08 04:40:54,Padnug after party! (@ Thirsty Lion Pub &amp; Grill) http://t.co/GTg7TYJw86
420764174570885120,2014-01-08 03:49:31,Don't be stupid on purpose - @agile_coach
420736598222049280,2014-01-08 01:59:56,Padnug! Let's talk about SCRUM!! (@ Health &amp; Science School) http://t.co/debJjchFsC
420564510773379072,2014-01-07 14:36:07,For Love of Software: Articles I read in 2013 --&gt; http://t.co/7tcQ9BeoAc
420362981331841025,2014-01-07 01:15:19,"RT @mikewhitmore: ""Don't answer every question your kids ask. Let them find the answers and experience the wonder of discovery for themselv…"
420326946711822336,2014-01-06 22:52:08,My buddy just showed me this: The Gadgeteer! Another great project I've got to try out --&gt; http://t.co/CsBWvGORsu
420279125367328768,2014-01-06 19:42:06,AngularStrap - Bootstrap directives for Angular.js --&gt; http://t.co/7sxVuErBoQ
420244698188771328,2014-01-06 17:25:18,"Tommorow's #PADNUG is ""Effective Scrum and High Quality Code"". Join me there!  Details --&gt;  http://t.co/7ybdERRzEO"
420205150931025920,2014-01-06 14:48:09,"A Coder, a Programmer, a Hacker, a Developer, and a Computer Scientist walk into a Venn Diagram --&gt; http://t.co/EmIcnRjyYp"
419902306403246080,2014-01-05 18:44:45,Very cool: My Nerd Story (via @skinny) --&gt; http://t.co/vYF5dpVaqT
419686145937932289,2014-01-05 04:25:49,Raspberry Pi Programming For Beginners --&gt; http://t.co/3lrDp13CVt
419679408937398272,2014-01-05 03:59:03,"You know it's true!  
#geekhumor http://t.co/y6BX34C96D"
419146623554297856,2014-01-03 16:41:57,"RT @fox12oregon: A lion is apparently on the loose near Tampa, Florida, sheriff's office searching for animal -  @MyFoxTampaBay"
419137218272571392,2014-01-03 16:04:34,PHP is as secure as any other major language --&gt; http://t.co/zi8TuZhxWr
419134137463623681,2014-01-03 15:52:20,@adapteva Good to hear!
419128410254753793,2014-01-03 15:29:34,"@adapteva Nice! are these the KS backers, or pre orders that are shipping?"
418982168669728768,2014-01-03 05:48:27,Tis The Season For Mainstream Warnings About “God-Like” Gov’t Threats To Privacy --&gt; http://t.co/RtxrQTmiXi
418961514154848256,2014-01-03 04:26:23,Picture of truck from Canyonview Road truck fire earlier today. Thankfully nobody was hurt. #firecom #pdxtraffic http://t.co/j6yQbg0qmi
418869262959124481,2014-01-02 22:19:49,"RT @KF7PSC: Garbage truck is actually a cardboard recycling truck, apparently there's also cans of something that are going off."
418864125846904832,2014-01-02 21:59:24,"CANYONVIEW RD/NW OLSON RD Reported Garbage Truck on Fire, Gaston and Yamhill En Route #PDXTraffic"
418862267170443264,2014-01-02 21:52:01,TRUCK FIRE - NW CANYONVIEW RD/NW OLSON RD #firecom
418850717693386752,2014-01-02 21:06:07,"Rex is a palm-sized, single-board computer with a full OS that is designed to power your robots --&gt;  http://t.co/zA385v2VL3"
418849240442740736,2014-01-02 21:00:15,Black Tie - Free Handsome Bootstrap Themes --&gt; http://t.co/tzyBh8GNNp
418784939169951744,2014-01-02 16:44:44,Starting to see the F# tab more on @MSDN. Wondering if it's a response to real world usage or an attempt to create it http://t.co/ZVlBKwCHLh
418512338753691648,2014-01-01 22:41:31,RIP Uncle Phil --&gt;  http://t.co/3dgEs9DB0x
418233918660567041,2014-01-01 04:15:11,Had a few too many? Trimet is offering free rides after 8pm. There's no excuse to put yourself or others in danger! http://t.co/17yy7bexIF
418186773395554304,2014-01-01 01:07:50,RT @shanselman: Support women coders! Intel HTML5 Elves will donate $1 to @GirlsWhoCode for every RT this gets! #Intel #GiftOfCode http://t…
418141011022708736,2013-12-31 22:06:00,"My friends: This is a nice, hardworking guy who got screwed over, and needs a little help. Any bit counts. --&gt; http://t.co/BQMQXXbs5V"
418133011679694848,2013-12-31 21:34:13,NetAppVoice: Social Media Crisis? 4 Ways To Exploit The Opportunity --&gt; http://t.co/bJWBC7caPH
418030105467052033,2013-12-31 14:45:18,How to Create a Cloud Service with Windows Azure  --&gt; http://t.co/Ch0mBnkt8q
417930267680989184,2013-12-31 08:08:35,@epiccitizen jeremymorgan [at] http://t.co/k82bdoKfKd
417928446933602304,2013-12-31 08:01:21,"@epiccitizen Yeah, no prob."
417927980589920256,2013-12-31 07:59:29,"@epiccitizen Not to dis Hillsboro, it's non combat but I'm sure the training is really good. Those guys know what they're doing for sure."
417927676301549568,2013-12-31 07:58:17,"@epiccitizen I think we're taking out of district volleys soon, where we pull shifts. We've done over 400 calls this year and rising."
417925709030371328,2013-12-31 07:50:28,"@epiccitizen Great dept, but volunteers are non combat.. how far are you from Gaston? lol"
417918492113768448,2013-12-31 07:21:47,MVA-INJURY ACCID - SW SPRING HILL RD/SW LASALLE RD #firecom
417852860475650048,2013-12-31 03:00:59,Forest Grove police log: officers respond to possible drones and electronic voodoo --&gt; http://t.co/9FmJqMkrns
417790238174756864,2013-12-30 22:52:09,Embrace the suck: The Big Netflix Purge of January 2014 --&gt; http://t.co/doSaDS4vZ2
417715807750062080,2013-12-30 17:56:24,"@davidstanley01 This is the approach I generally take, but I've been challenged on it before. For me it's data model first every time."
417701860451942401,2013-12-30 17:00:58,"I'm hiring an http://t.co/VPnXcf3R7c Web Developer in the Portland (#pdxjobs) Stable company, 40 hours a week! --&gt; http://t.co/JmZhzaKVB0"
417696338550067201,2013-12-30 16:39:02,".@jedgar sorry to see you guys wrapped up scandal today. I have not lost faith in the @digitalocean product or team, and I hope others wont."
417690887595261952,2013-12-30 16:17:22,Microsoft's Midori: The M# connection --&gt; http://t.co/9OxORCFp30
416871484142133248,2013-12-28 10:01:21,How Social Media Is Changing Incident Command --&gt; http://t.co/vVmaArYhPH
416702261788954624,2013-12-27 22:48:55,"A&amp;E remembers that they like money, reinstates Phil Robertson --&gt;  http://t.co/NK0dcSU1uF"
416676375106699264,2013-12-27 21:06:03,"The 38 Most Haunting Abandoned Places On Earth. For Some Reason, I Can’t Look Away --&gt; http://t.co/VyFdyDKnZj"
416644581258956800,2013-12-27 18:59:43,"N.S.A. Phone Surveillance Is Lawful, Federal Judge Rules --&gt;  http://t.co/A79aqOErgJ"
416396701084037120,2013-12-27 02:34:44,RT @WashCoScanner: Crossing arms at Canyon x Lombard not working properly.  ETA for Portland &amp; Western RR to arrive to repair them is one h…
416380981235687424,2013-12-27 01:32:16,Good News You Might Have Missed in 2013 --&gt; http://t.co/T43yUf059V
416316542453035008,2013-12-26 21:16:13,West Linn crime wave! Brace yourselves: http://t.co/fcQAYmHrz5
416256741710393344,2013-12-26 17:18:35,@jankarres Jeremymorgan [at] gmail
416234038199070720,2013-12-26 15:48:22,The 50 Dumbest Tweets of 2013 --&gt; http://t.co/ldWk2PEH9W
415802176934395905,2013-12-25 11:12:18,Watching training videos (emergency!) at station 11 http://t.co/Ob2x4IxjL2
415784355492286464,2013-12-25 10:01:29,Who’s Selling Credit Cards from Target? --&gt; http://t.co/ZiU52nvIR2
415774973492330496,2013-12-25 09:24:13,"RT @WashCoScanner: Location of 3RD ALARM house &amp; garage fire outside of Yamhill -need Sheriff for traffic control for ""looky loos"" http://t…"
415742782276259840,2013-12-25 07:16:18,"RT @WashCoScanner: Recalling 3rd Alarm, all equipment on scene working, extended overhaul - Res Fire outside of Yamhill near Camp Yamhill &amp;…"
415737282948104192,2013-12-25 06:54:26,RESIDENTIAL FIRE - 19470 NW OLD RAILROAD GRADE #firecom
415724610999832576,2013-12-25 06:04:05,Heartbreaking: New Hampshire Firefighter Responds to Fatal Accident Involving Daughter on Christmas Eve --&gt;  http://t.co/hUYANMEYvz
415589218468253696,2013-12-24 21:06:05,7 Python Libraries you should know about --&gt; http://t.co/B4i1S4ILVJ
415583887914328064,2013-12-24 20:44:54,RT @WashCoScanner: RT @KF7PSC: Report of a guy driving a Lebaron convertible with a bag over his head with face cut out
415526581566980096,2013-12-24 16:57:11,Some lesser-known truths about programming --&gt; http://t.co/JZ3ZZrO03x
415467400478605312,2013-12-24 13:02:01,50 Places You Can Learn to Code (for Free) Online - Online College Courses --&gt; http://t.co/Vy9Mf7NSUI
415421969593823232,2013-12-24 10:01:30,Sorrow and Elation - Why Reflection Isn't Always Your Friend --&gt; http://t.co/3jTUznp70B
415397876735307777,2013-12-24 08:25:46,Busy night at Station 11. I think this is the latest I've ever gotten home from drill.
415298662604894208,2013-12-24 01:51:31,"Yeah, the site looks great.. .but there is a bunch of gibberish on it.. looks like Spanish or something... Can we remove that? #lipsum"
415298450893201408,2013-12-24 01:50:41,@shanselman @G4LHT I probably should have mentioned It's running an SSD. Definitely makes a huge difference.
415296814284161024,2013-12-24 01:44:11,"@G4LHT @shanselman Yeah my ""carry and hack"" hardware is older as usually beat it up. I'll put it on my office mac soon. i3 runs good though."
415293734469660672,2013-12-24 01:31:56,"@G4LHT @shanselman It runs great. A bit faster than Win7 even, due to it a being a fresh install. Older TP, Core i3-380M w/ 8gig RAM"
415274579381067776,2013-12-24 00:15:49,Ok @shanselman You convinced me. 8.1 install on my think pad is complete! http://t.co/DvYJcGCKvg
415261654855602176,2013-12-23 23:24:28,Update: accident on 47 w/extrication #firecom #pdxtraffic http://t.co/ehJnuW7hcl
415226844217372672,2013-12-23 21:06:08,Show Busy Indicator on Form Submit using JQuery and Ajax --&gt; http://t.co/NqKDuiH0io
415168868240601088,2013-12-23 17:15:46,5 “Foundations” Of SEO That Were Torched In 2013 --&gt; http://t.co/KfApQrC1c3
415143183006572544,2013-12-23 15:33:42,This shows some promise: AngularJS Hub --&gt; http://t.co/2XYPjQ563h
