144535316991197184,2011-12-07 21:54:39,Smile! Ron Gutman has a great new TED Book about the science of smiling. http://t.co/J0xcATjr
144246312441872384,2011-12-07 02:46:15,"""Cities are the great hope for our future."" http://t.co/S9WCQ6Oo"
144133644464828417,2011-12-06 19:18:33,"Killer #TED talk by @luisvonahn on massive-scale online collaboration http://t.co/RNl97agf Funny, brilliant, inspiring."
144080452880302082,2011-12-06 15:47:11,"Announcing the surprise winner of the 2012 TED Prize... not a person, an IDEA crucial to earth's future http://t.co/HoizfI7o"
143753449564155905,2011-12-05 18:07:47,Our 2011 countdown on Huffington Post continues with #16 Deb Roy: The Birth Of A Word http://t.co/p5sZrjfu Astounding!
143737469727277057,2011-12-05 17:04:17,"Today's #TED, an eloquent manifesto of nonviolence by an amazing man Srdja Popovic. Please RT!  http://t.co/9kkfQXEY"
143725483371151360,2011-12-05 16:16:40,"""One of TED's finest ideas"". Forbes' take on TEDActive. Fun read  http://t.co/wxvLhsSf"
143019135981465602,2011-12-03 17:29:53,"This email made me smile. ""TED goes to jail"" http://t.co/gfL8VZxQ"
142298286609530880,2011-12-01 17:45:29,Excited to introduce Best of TED 2011 w/@ariannahuff The countdown begins! http://t.co/TSv54k4j  #18ideas
142241755646001152,2011-12-01 14:00:51,This short video is beautiful add to the spectacular Forbes cover story on @acumenfund http://t.co/m5Wb2mId
142230707585024000,2011-12-01 13:16:57,"New @TEDbook today! ""Launching the Innovation Renaissance"" by Alex Tabarrok. Powerful, fast read. http://t.co/9JodK19Q"
142223510616539136,2011-12-01 12:48:21,Bono is an unbelievably good writer - his NYT column today is must-read http://t.co/1DwEOkxB
141976945599590400,2011-11-30 20:28:36,Excited for TEDxWomen tomorrow. Great line-up. Streamed live to more than 100 locations. http://t.co/Kgve4NpV
141962103799025664,2011-11-30 19:29:37,"Pride, dept. The woman I am lucky enough to be married to is ON THE COVER OF FORBES! http://t.co/fX9e5oIP"
141917085059125248,2011-11-30 16:30:44,"I love, love, love the astounding creativity in today's dance-enhanced #TED talk! http://t.co/KUJ4CCxR"
141612504785752065,2011-11-29 20:20:26,"Inspiration, Education, Innovation at TEDYouth in NYC http://t.co/ZLd1VL1x Great reminder of a thrilling day"
141581662273282048,2011-11-29 18:17:53,"The new #TED iphone app has playlists - inspiring, ingenious, etc - to fit the time you have available http://t.co/7h9Nodq9"
141571995673436161,2011-11-29 17:39:28,@nomadicverses Can't help in 140 characters.  but maybe some http://t.co/CW9rM8xo speakers can... browse away
141535240324792321,2011-11-29 15:13:25,@OlaRashed All on our website...
141534432824791040,2011-11-29 15:10:13,"@radyqu For those, try the excellent 3rd party app TED+subtitles !"
141521508353843200,2011-11-29 14:18:51,"Do you have an iPhone? You might just love the new #TED app, complete with ""TED Radio""! http://t.co/7h9Nodq9"
141520974574125056,2011-11-29 14:16:44,The incredible poem for daughters that Sarah Kay gave us at #TED is now a beautiful hardback! http://t.co/KYf3UpMS
141153015645208576,2011-11-28 13:54:36,Transport dream: a high-speed train that never stops?! http://t.co/C5mpDvdz
140821961210208258,2011-11-27 15:59:06,Double amputee Amy Purdy describes how she became a pro snowboarder. Inspiring. http://t.co/8EsV45pq
139773035979866112,2011-11-24 18:31:03,Another column inspired by Steve Pinker's spectacular book on the decline of violence http://t.co/F19jfob7 Bravo Nick Kristof!
139737863670603780,2011-11-24 16:11:17,Nature. Beauty. Gratitude. http://t.co/zsLzKfP6  Happy Thanksgiving!
139713212147965952,2011-11-24 14:33:20,"On Thanksgiving Day in a turbulent world, a moving reminder of nature, beauty, gratitude http://t.co/zsLzKfP6"
139701657293434881,2011-11-24 13:47:25,"Thanks @QueenNoor RT @rago_legal I am wth Jehane @ police station, she is fine. Most likely,charge is filming without permit"
139698644646494208,2011-11-24 13:35:27,"...and contrary to last night's hopes, sickened to hear Jehane Noujaim still held in Egypt, facing charges. #freejehane"
139697492051767296,2011-11-24 13:30:52,Horrified to read of the treatment in detention of @monaeltahawy http://t.co/KGhqXlKJ
139510206542524417,2011-11-24 01:06:39,Better news... RT @rago_legal We found Jehane... at North Cairo Prosecution. Spoke to her she is ok ...home tonite. #Tahrir
139416953285644288,2011-11-23 18:56:06,Our thoughts are with #TED prize winner film-maker Jehane Noujaim reportedly detained during unrest at #Tahrir
138697662621941760,2011-11-21 19:17:54,Spectacular visualization of the entire scale of the universe - slider at the bottom http://t.co/OuDzB6VA (via @brindis15)
138650161755856896,2011-11-21 16:09:09,"Beware the Big Boulder from Space! Phil Plait delivers a terrific #TED talk at... yes, TEDxBoulder http://t.co/xgWO6YTR"
138070556309336064,2011-11-20 01:46:00,@g_kima Woah Really? at 7 years old?? I'm surprised - and pleased! Pass on a thumbs up from me...
137953554567667712,2011-11-19 18:01:05,TEDYouth is starting! watch live here:  http://t.co/18wXPL02
137878324243480577,2011-11-19 13:02:08,Talks and youthful action streaming live from many places in the world on http://t.co/18wXPL02   Love it!
137570959954685954,2011-11-18 16:40:47,TEDxYouthDay this weekend is going to be awesome. Dozens of events around the world. Check it out! http://t.co/18wXPL02
137203457051463680,2011-11-17 16:20:27,Can we live longer? Today's #TED features Cynthia Kenyon http://t.co/TEk5znLi  + she's on ABC News tonight with @dianesawyer
137159198038437889,2011-11-17 13:24:35,"My morning moment of wowness... (thank you @reddit) ""insane guitar skills"" http://t.co/2SarBLEc"
136489981156921344,2011-11-15 17:05:22,Our spectacular planet. Time-lapse video shot from international space station http://t.co/95z218CO
136211565564280832,2011-11-14 22:39:02,"Great pic and report of a landmark day --&gt; ""Iraqis renew hope at TEDxBaghdad"" http://t.co/poSXSIO8"
135120584282619904,2011-11-11 22:23:52,Another remarkable step in the TEDx journey. Tomorrow sees the first #TEDxBaghdad. Cheering you on! http://t.co/q8RV2CKv
135009623110459392,2011-11-11 15:02:57,Congrats to all at @acumenfund for turning patient capital into a global movement. Last night's 10-yr celebration was epic! #AF10
134992860687773696,2011-11-11 13:56:20,Calling all youth! What can YOU share with the world?! http://t.co/VM6Eq7kS  #TEDxYouthDay
134380433071812608,2011-11-09 21:22:46,Can you teach something mindshifting in 9 mins? It could get you a free pass to TED2012! http://t.co/np9I1vXw
134356845803487232,2011-11-09 19:49:02,"Streets are the world's ""largest art gallery"". Rockin' MTV video report on #TED Prize winner JR http://t.co/KNSDiUfx"
134299406634725376,2011-11-09 16:00:48,"TED-Ex, TED-Hex,TED-Mex... fun twitter thread from @ethanZ http://t.co/EefQZfxo"
134288114465259522,2011-11-09 15:15:56,"TED Talk literacy... now 12-yr-olds are doing it. Thomas, you rock! http://t.co/OXyuUAXK"
133940056871276545,2011-11-08 16:12:52,Gecko inspired adhesive tape! http://t.co/VZeJEsSA ...Robert Full's #TED dream comes true!  http://t.co/f2jVrviN
132825454523584512,2011-11-05 14:23:50,Here's first of our weekend TEDx talks. @PaulLewis on crowd-sourcing the news http://t.co/GEb97Yyt  - from TEDxThessaloniki
132823669809487873,2011-11-05 14:16:45,TED hasn't usually posted talks at weekends. But a torrent of amazing TEDx content means now we can http://t.co/UVGgyirm
132514818971271168,2011-11-04 17:49:29,Here's my pick of 7 of the year's biggest ideas http://t.co/5KJlWBY5  (talk-links at end of captions)
132484596288864257,2011-11-04 15:49:23,Marco Tempest and his dazzling techno-magic! http://t.co/3oLJlHt4
132116926422986752,2011-11-03 15:28:24,Daniel Wolpert offers an intriguing way to think about brain design. Fab #TED talk. http://t.co/NyVkmQWf
131387662346100737,2011-11-01 15:10:34,"Fascinating, controversial #TED Talk from Paul Zak on how moral behavior is impacted by oxytocin http://t.co/gmLNg745"
131142992512827392,2011-10-31 22:58:20,"As world population hits 7 billion, this ingenious Hans Rosling talk is worth another look!  http://t.co/HZaCSrJT"
130362613749137408,2011-10-29 19:17:23,TED is proud to be one of the new media partners chosen by Youtube http://t.co/6588pDJh Great TED-Ed vids a-coming...
129919385409298433,2011-10-28 13:56:09,"For Zoe, who passed away 10 months ago today...... http://t.co/qNk92Mgi"
129904999424737280,2011-10-28 12:59:00,"Lots of buzz for post by @nickbilton. Does Jobs' TV comment ""I've cracked it!"" mean Siri interface? http://t.co/w9NLfSVT"
129771224099332096,2011-10-28 04:07:25,"A weapon of mass dissemination.""TEDx in a Box"" http://t.co/ZRoj0cxp ...brilliant design by IDEO"
129226159006289921,2011-10-26 16:01:31,Bombsight revelation. Malcolm Gladwell back on #TED with great new talk. http://t.co/2USqA7Ek
128871776288636928,2011-10-25 16:33:20,"Hearty congrats to the new class of TED Senior Fellows, just announced   http://t.co/4Ff9obnQ  Counting on you to make waves!"
128857557266739200,2011-10-25 15:36:50,What a beautiful idea.. the building that will take 80 years to grow http://t.co/ki31b5Ff
128851472904499201,2011-10-25 15:12:39,Iain McGilchrist + magic of RSA Animate make a mesmerizing best-of-the-web talk on the divided brain http://t.co/l0du6qoT
128818452654866432,2011-10-25 13:01:27,"Bjork + ipad = creation of a brand new art-form.  Biophilia is astounding, thrilling.  http://t.co/wmmj5Pxy"
128803400681930752,2011-10-25 12:01:38,Saw Tony Fadell's amazing Nest before launch. Oh my... Who knew thermostats could be made BEAUTIFUL?! http://t.co/m2ICyEHc
128509689154650112,2011-10-24 16:34:32,Impressed with Zite on iPad. Your Twitter name is enough to give you a superb personalized iPad magazine http://t.co/J5hdPu3S
128168906325110784,2011-10-23 18:00:23,"Superb, truly superb piece on cognitive errors. Danny Kahneman amazes and delights http://t.co/mP1lJ20H"
127482185782542336,2011-10-21 20:31:36,"For someone who used to publish magazines, this short vid says it all. http://t.co/C9eOZ7f2"
127394927519875072,2011-10-21 14:44:52,TED Prize winner JR's InsideOut project lights up Occupy Wall St. Wow! http://t.co/YQcuOlv4
127390090124206080,2011-10-21 14:25:38,"Brooks on Kahneman, a man who has shifted forever how we think of human nature http://t.co/VO8JKGy7"
126377217428168704,2011-10-18 19:20:51,Vaccine breakthrough?! I suspect this is today's most important news story http://t.co/Jshqu3V1
126288861033791488,2011-10-18 13:29:45,Is this really a quantum effect?! Wild http://t.co/KkBi3PEX
126019136127111169,2011-10-17 19:37:58,Stunning video mashup in homage to David Deutsch's new masterwork http://t.co/gxM3bDnN Kudos @jason_silva
124891499564503040,2011-10-14 16:57:08,The art of dying... A mushroom burial suit stars in what might be the strangest TED talk ever! http://t.co/vhz0M7uD
124660995070238720,2011-10-14 01:41:11,"DEDTalks? OK, I laughed. http://t.co/CWTEkCkN"
124642938658619392,2011-10-14 00:29:26,"@anishmohammed That's not me, btw, that's @chr1sa"
124499997776551936,2011-10-13 15:01:27,How to spot a liar. This is a skill we all need! Pam Meyer shows how. Fun #TED talk. http://t.co/HGzLUsEq
124128864132792321,2011-10-12 14:26:42,"As this NY Observer piece shows, you and I are not the only ones suffering email overload! http://t.co/yd3LgLEQ"
124093148438855680,2011-10-12 12:04:46,The Big Shift vs the Great Disruption. Friedman in fine form today... http://t.co/GIFlCoeo
123794386348810240,2011-10-11 16:17:36,"Designer Richard Seymour on the emotional power of beautiful objects. Great talk, I thought. http://t.co/guQ54TNM #TED"
123771935900450816,2011-10-11 14:48:23,Do you want to be part of the @TEDxYouthDay intro video? Learn more at http://t.co/Ck9uSTs9
123018272345030656,2011-10-09 12:53:36,LOVE this NYT piece by David Rothkopf on what a society should aim at  http://t.co/0TVKXGrJ
122069895134461953,2011-10-06 22:05:05,"RT @BBCNewsnight: Steve Jobs 'built the tools that unlocked the creativity of a whole generation' Chris Anderson, the curator of TED tel ..."
121811088445673472,2011-10-06 04:56:41,"""Your time is limited, so don't waste it living someone else's life."" Steve Jobs  http://t.co/aHcvNLNt"
121808754747523073,2011-10-06 04:47:24,"""Steve Jobs changed my life..."" My colleague Tom Rielly speaks eloquently for many of us http://t.co/CX5kp6EF"
121805193124904961,2011-10-06 04:33:15,"He fused and transformed Technology, Entertainment and Design like no other, the ultimate TED hero. #ThankYouSteve"
121535603555827712,2011-10-05 10:42:00,Light from a plastic bottle. Beautiful example of innovation by slum-dwellers... http://t.co/0gXTrOuX (via @simonbrading)
121313535451074561,2011-10-04 19:59:35,"Amazed and embarrassed by this posting but, alas, the answer to the kind question is ""No""!  http://t.co/gG9Sb7yE"
121234662411599872,2011-10-04 14:46:10,Another fantastic TEDx talk now on TED.com: Chris Adami's mindblowing research into artificial life  http://t.co/WxZF5CZ1
121223634739142656,2011-10-04 14:02:21,"Perlmutter, Schmidt and Riess transformed our view of the universe. Worthy Nobel winners http://t.co/mBH3Rt5g"
119435218842161154,2011-09-29 15:35:49,Fight bad science! #TED speaker @bengoldacre crams record-breaking number of wise words into 18 mins! http://t.co/FtPAoArz
119084281850118145,2011-09-28 16:21:19,Is the web driving generosity? Thoughtful post by @sashadichter on a talk I gave last night http://t.co/MmknmzPv
116912713157967874,2011-09-22 16:32:17,"@LatikaRoy Wow... beautiful talk, Jo. Congratulations. I'll ponder if there's something more we can do with it!"
116903970865283073,2011-09-22 15:57:33,I was blown away by Steve Pinker's new book on the DECLINE of violence. First review is a rave http://t.co/63hF4zx6
116898004463665152,2011-09-22 15:33:50,"Shocking, brilliant #TED talk on a contagious cancer http://t.co/5yKhSqeS"
116875599011774464,2011-09-22 14:04:48,It's been thrilling to see Kickstarter take off so spectacularly. Great NYT piece today http://t.co/7SKgvT96
116316525291503616,2011-09-21 01:03:15,A super warm Twitter welcome to a world-changing woman @melindagates. Be one of her founding followers - and retweet!
115905626034548736,2011-09-19 21:50:29,I'm curious. Any chance you could share how & when you watch #TED talks?  http://t.co/a3Vnl1JU
115139815627952129,2011-09-17 19:07:25,Great talk on generosity from Sasha Dichter  http://t.co/wT0x3GzC
114468756557807616,2011-09-15 22:40:52,"Reddit rocks! Insightful and hilarious answers to ""Which are the best #TED talks?"" http://t.co/dmph9xJ7"
113630846333894656,2011-09-13 15:11:19,Misha Glenny's latest TED Talk has surprising advice re the world's most notorious hackers http://t.co/IYdIPSX
111872126797099008,2011-09-08 18:42:48,Taiwanese animators' hilarious take on the TechCrunch controversy http://t.co/6t2ardw
111824333919363072,2011-09-08 15:32:53,RT @quixotic: Great analysis and call to action by Jeff.  Couldn't agree more. http://t.co/j2uBvgC
111822200037851137,2011-09-08 15:24:24,Lee Cronin's remarkable research project could create non-carbon-based life http://t.co/5AApNZ2
111799572988309505,2011-09-08 13:54:29,Robot innovation. Sometimes simplest ideas are the best. A universal gripper made from ground coffee! http://t.co/6gyCDyi
111475536257224705,2011-09-07 16:26:53,@Padbrit They're working fine here... English subtitles by default. No?
111454894434680832,2011-09-07 15:04:52,"A moving story told at TEDxParis by Sarah Kaminsky: ""My father the forger"" http://t.co/UKtksoB  Don't miss the ending!"
111438416679411712,2011-09-07 13:59:23,Seth Godin's eloquent plea to End Malaria  http://t.co/L1OX48M
111089317392297984,2011-09-06 14:52:11,"Edward Tenner is a world expert on tech's unintended consequences, good and bad. Fascinating #TED talk http://t.co/Scgsnax"
109242999766122496,2011-09-01 12:35:35,"TED speaker Kevin Slavin has starring role in the new ipad ad ""Learn"" linked to mid-way-down on RHS here http://t.co/spTSgvo"
108932724802334720,2011-08-31 16:02:40,Julia Bacha inspired me at TEDGlobal with her call to focus on the Palestinians practicing nonviolence http://t.co/ou0fbk7
108563561424494592,2011-08-30 15:35:44,Fascinating #TED talk from the geneticist who showed that early humans must have mated with Neanderthals http://t.co/YbvrrNn
108493419936096256,2011-08-30 10:57:01,Luxury vs community. David Brooks' NYT column today strikes me as profoundly wise... http://t.co/I4Diu6B
108483046164021248,2011-08-30 10:15:48,AI vs. AI. Two chatbots in conversation with each other hilariously fail the Turing test. http://t.co/irQJcPM
107788633804767234,2011-08-28 12:16:27,"Hurricane Irene first hitting the NC coast? Er, no. http://t.co/QmHAsoM"
107782751415042048,2011-08-28 11:53:05,"Expected to wake up to 85mph hurricane Irene winds. Instead... 35mph.  But that's a good thing, right?"
106808583999594496,2011-08-25 19:22:05,"I just re-watched Steve Jobs' powerful Stanford speech, more poignant than ever. ""Do what you love."" http://t.co/stzRb1a"
102048070132441088,2011-08-12 16:05:30,3 iphones and a whole lot of magic in one of the most startling performances ever seen at #TED http://t.co/31jea6l
101315392101826560,2011-08-10 15:34:06,Do current events feel apocalyptic? Here's an antidote. Inspiring peace campaigner @JeremyGilley http://t.co/VFVsm3a #TED
101074390732640258,2011-08-09 23:36:27,"After the riots, a Twitter-coordinated cleanup. http://t.co/6J1GRoz  Most hopeful thing I've read all week #riotcleanup"
100952594251386881,2011-08-09 15:32:28,"Sickened by what's happening in my home country, Britain. This blog post as good an analysis as any http://bit.ly/npZ2En"
100703961891344384,2011-08-08 23:04:30,So sad to hear of the passing of sustainability pioneer Ray Anderson. He inspired many at TED http://t.co/kUw5ohP
100600467075248128,2011-08-08 16:13:15,RT @tedtalks: Today's #TED: @AlexSteffen on how cities can help save the future: http://on.ted.com/Steffen11
99503180819345410,2011-08-05 15:33:01,Provocative short #TED talk from 'professor of evil' Phil Zimbardo. Are we witnessing the demise of guys? http://t.co/7UcX7gg
98775766208221185,2011-08-03 15:22:32,"Fantastic, mind shifting #TED talk on the evolution of language from Mark Pagel http://t.co/Gg97RfB"
98770803541295104,2011-08-03 15:02:49,No Kindle? All 7 TEDBooks are now available in the iBookstore! http://t.co/gtrZZHv
98502385772666880,2011-08-02 21:16:13,Outrageously long interview in the Australian magazine Dumbo Feather. For #TED fanatics only! http://bit.ly/nEK88i
98471326624395264,2011-08-02 19:12:48,High-bandwidth wireless data from LED lighting?! This #TED tech demo opens new world of possibility http://t.co/zikjvDS
97037822954971136,2011-07-29 20:16:34,"""All government, every virtue, and every prudent act, is founded on #compromise..."" Edmund Burke"
96637351899578368,2011-07-28 17:45:14,Email stress is even more widespread than I realized.  http://t.co/YH0XXNh has notched up 5k tweets and 10k likes.
96599090015641600,2011-07-28 15:13:12,@kimyorio They do. It's called rain!
96572924345057280,2011-07-28 13:29:14,Surprising fact of the day (via Reddit). A thundercloud can weigh more than 1m tons http://bit.ly/p4bfgI
96282802236043266,2011-07-27 18:16:23,The current #DCmadness reminds me of this chilling tale... http://bit.ly/qNfytp
96245255883599873,2011-07-27 15:47:11,"Psychologist Paul Bloom's #TED talk on why we like what we like is convincing, captivating - and funny http://t.co/l8pwAwW"
95980782681735168,2011-07-26 22:16:17,Finally America's leaders are acting in unison. http://t.co/dZdCQGC
95978032182996992,2011-07-26 22:05:20,Know anyone remarkable who cd benefit from #TED? Deadline for TED2012 Fellows is just 4 days away: http://t.co/7xcMOh1
95872891941437440,2011-07-26 15:07:33,The surprising Math of city size in Geoffrey West's mind expanding #TED talk http://t.co/GNiy9Oh
95624661169209344,2011-07-25 22:41:10,"Cheering on my cool relatives Bob and Cortney & their new design make-over TV show, Home By Novogratz. Tonight HGTV 10pm ET"
95619614813339649,2011-07-25 22:21:07,Great to see Rory Stewart's razor sharp #TED talk just made the front page of the Huffington Post http://huff.to/n6wu6K
95513655369666561,2011-07-25 15:20:04,Why we must end the war in Afghanistan - a stunning talk at #TEDGlobal from MP Rory Stewart http://t.co/XMcN5Vb
95080758238117889,2011-07-24 10:39:53,A US presidential candidate chosen online? http://t.co/7jSyelx gets a massive boost from Tom Friedman http://t.co/mq9nZGk
94500941709062145,2011-07-22 20:15:54,Sizzling postscript to Smartbird flying robot demo: footage of it being divebombed by seagulls! http://t.co/c41i7Ef
94477257900429312,2011-07-22 18:41:48,The Smartbird flying robot makes the front page of Reddit http://bit.ly/qI1nQR #tedglobal
94416061969076224,2011-07-22 14:38:38,"This is a must-watch. 6-min demo of a robot that flies like a bird (yes, with flapping wings) http://t.co/vOvwx0i  #tedglobal"
94411078380949504,2011-07-22 14:18:49,"Contrary to impressions, the world is slowly getting less violent.  This event aims to hasten the trend! http://t.co/2DVzYtj"
94406984496988160,2011-07-22 14:02:33,We're about to post a gobsmacking beautiful tech demo from last week's #TEDGlobal.  Prepare for lift-off... !
94406136521961472,2011-07-22 13:59:11,Email stressed? CBC is broadcasting an interview with me about http://t.co/YH0XXNh  Listen here: http://t.co/fCkgxV8
94388834678218753,2011-07-22 12:50:26,"RT @BBHLabs: ""Tomorrow is our permanent address."" One of our favourite McLuhanisms - he would have been 100 today."
94116797841813504,2011-07-21 18:49:27,"Powerful 3rd party app for iphone and ipad offers #TED Talks with subtitles, search, filters & more! http://t.co/gLSbxac"
94105346741768192,2011-07-21 18:03:57,Delightful new TEDBook by lexicographer @emckean has an intriguing title that's too long for this tweet! http://t.co/mcWMnVh
94082304485507072,2011-07-21 16:32:24,Brilliant! RT @tedtalks Today's #TED: Kevin Slavin on how algorithms are changing our lives: http://t.co/hAqaxwX
93381964685508609,2011-07-19 18:09:29,A blockbuster #TED talk from @mikkohypponen on the threat to the web from cyber-crime http://t.co/OoJ2maC Riveting!
93078749326749696,2011-07-18 22:04:37,Report on TEDGlobal in Nature ends with fine summary of Alain de Botton's killer talk on Atheism 2.0 http://bit.ly/qd5BDo
93077106300420097,2011-07-18 21:58:06,Inc dives into TED to find 4 thoughtful tips for event organizers. I like their choices. http://bit.ly/qa5txX
92654568210579457,2011-07-17 17:59:05,"Another hug for Dr Love! RT @pauljzak #TEDGlobal over, but my brain still on fire. Best meeting I have ever attended, by far."
92653385119039488,2011-07-17 17:54:23,RT @leecronin: Is TED a cult? Only if you think that curious optimistic people who think ideas can change the world fit the cult profile ...
92493322572140545,2011-07-17 07:18:21,"What's missing here: http://t.co/7Cyx9QG  #TED's growth is due to thousands: team, speakers, translators, TEDx, & more..."
92487969994313728,2011-07-17 06:57:05,"The Observer says I'm the anti-Murdoch, and TED (science, ideas) is ""actual news of the actual world""?! http://bit.ly/roV9Tx"
91899218817593344,2011-07-15 15:57:35,Here's the talk on trrial and error from @timharford I was raving about earlier in the week. Just posted. http://t.co/4PbK9iM
91898895197671424,2011-07-15 15:56:18,"A huge thank you to all the speakers, attendees and colleagues who made #TEDGlobal unforgettable.  Now to unwind...!"
91803176767995904,2011-07-15 09:35:57,"Malcolm Gladwell wrapped up a packed #TEDglobal session with a mesmerizing story of bomb-sights, war and wisdom. I'm in awe..."
91576055126691840,2011-07-14 18:33:27,Spectacular web films on JR's TED Prize project launch today. Trailer http://bit.ly/qXnpue  Episode 1 http://bit.ly/oF5BQM
91499023789326336,2011-07-14 13:27:21,Courageous Alain de Botton on stage at #tedglobal unveiling his vision for Atheism 2.0 (hint - it borrows from religion!)
91471552473870336,2011-07-14 11:38:12,"2nd talk from #tedglobal is live.  Based on personal experience, Maajid Nawaz's vision for fighting extremism http://t.co/fzD83hD"
91468420226355200,2011-07-14 11:25:45,Pulsating performance from the Vertigo Dance Company. Whew!   (and impressed at our a/v team... great live edit) #tedglobal
91462888870510592,2011-07-14 11:03:46,"Guest curator Pat Mitchell, like Matt Ridley yesterday, is bringing amazing new speakers to TED  #tedglobal"
91461927863197696,2011-07-14 10:59:57,"""You fear what you don't know and you hate what you fear."" Inspiring Yemeni media owner Nadia Al-Sakkaf  #tedglobal"
91451767258222592,2011-07-14 10:19:35,"To kick off day 3 of #tedglobal, actress Thandie Newton offers a beguiling mix of eloquence and vulnerability. Big standing O"
91188380985065474,2011-07-13 16:52:58,Marco Tempest killing it at #TEDglobal with his augmented reality magic!
91179750193758208,2011-07-13 16:18:41,C'mon wise people. I need tweets about BODIES...  insightful or humorous. Tag 'em #tedworld.  Will read out best shortly #tedglobal
91175196450488320,2011-07-13 16:00:35,Does anyone have a message to the world about BODIES they'd like read out during upcoming session of #tedglobal ?  Tag it #TEDworld
91097663579226112,2011-07-13 10:52:30,"""Let's take back the Internet!"" The first talk from #tedglobal just went live http://t.co/6zD9hXo"
91094904524120064,2011-07-13 10:41:32,Mark Pagel thinks our destiny is to be one world with one language #tedglobal #controversial
91093663714787328,2011-07-13 10:36:36,Mark Pagel making compelling case for evolutionary significance of language as cooperation promoter #tedglobal
91085633203871744,2011-07-13 10:04:41,Upcoming session of #TEDGlobal on emerging order is guest curated by the brilliant Matt Ridley. This will be good.
