9622602868,2010-02-25 12:03:48,"Among hundreds of rave comments about Temple Grandin's talk, here's my favorite http://bit.ly/bzhWL7"
9621060519,2010-02-25 11:04:52,Giant water jets bursting from Saturn's moon Enceladus -  my new desktop image http://bit.ly/dw2eJ2
9596740129,2010-02-24 22:51:45,"Here's what Sergey Brin told me at #TED about Google's cyber-attack in China and ""Don't Be Evil"" http://on.ted.com/8A6D"
9581912505,2010-02-24 16:12:55,"If you were wowed by Claire Danes in this month's HBO movie, try the real Temple Grandin! http://on.ted.com/8A2B Amazing talk"
9580695648,2010-02-24 15:41:43,"""Without autism, no Silicon Valley"". The incredible Temple Grandin won a giant standing-O at #TED http://on.ted.com/8A2B"
9545101454,2010-02-23 22:09:16,"Good Mag's 10 Best Talks from TED2010 http://bit.ly/bgRUgI  (they somehow missed... TEMPLE GRANDIN, posting tomorrow!)"
9535079329,2010-02-23 17:38:54,Last week's #TED debate on nuclear power is now editors' pick on CNN.com http://bit.ly/bBQjPz
9530393469,2010-02-23 15:38:40,Eric Topol from TEDMED on the wireless future of medicine http://on.ted.com/89uf #TED
9481834198,2010-02-22 16:08:58,RT @acumenfund Interconnected world! 1st live #TED screening for local Nairobi youth...  http://ow.ly/19hiA Love it!
9479324816,2010-02-22 15:03:49,Philip Howard on how to ease the suffocating stranglehold of law in US http://on.ted.com/89lO  Please RT. Stunning talk. #TED
9479112288,2010-02-22 14:58:37,"We're about to release a talk from TED2010 that I wish every member of Congress, every Supreme Court justice would see...."
9474010804,2010-02-22 12:33:31,"An insider's view. David Hornik on ""the democratization of TED""  http://bit.ly/a71CdZ"
9388090557,2010-02-20 15:58:21,TEDxAustin is getting under way. Good luck!  Live-stream here: http://bit.ly/aBSEPr
9386042124,2010-02-20 15:01:55,Catching up on Mariane Pearl's thoughtful #TED post. Can We Spread Hope While Others Spread Fear? http://bit.ly/avNUXV
9385719201,2010-02-20 14:52:52,Thomas Dolby and Ethel provided fabulous music for this year's #TED. Inside story: http://blog.thomasdolby.com/?p=1009
9385575521,2010-02-20 14:48:33,The Economist comments on David Cameron's #TED talk http://bit.ly/aTsf6Z
9384606808,2010-02-20 14:19:57,Wow... 250+ retweets of Seth Godin's blog featuring @jnovogratz http://bit.ly/bF4Qh0  A whole lot of wisdom in 2 mins
9343459792,2010-02-19 17:04:18,I think this shd be our new ad campaign. ;-)  RT @DrewLudwig watching TED talks makes ironing better.
9340681951,2010-02-19 16:02:48,Kevin Kelly is a thinking person's rockstar. Great talk from TEDxAmsterdam on technology's destiny http://on.ted.com/89PI #TED
9336046734,2010-02-19 14:14:52,1 and 5 were massive hits. others also good RT @keithferrazzi The 5 Best TED Talks about Relationships http://bit.ly/aDowJR
9313811378,2010-02-19 02:11:04,I was criticized last year for reading questions for Bill Gates from my Mac. So this year...  http://bit.ly/cQjHT0
9297353088,2010-02-18 19:27:26,Interesting notes by @billgates on his time at #TED and background to the energy talk posted today http://bit.ly/cvC9eO
9290928368,2010-02-18 16:43:01,"""The year's most important climate speech"". Bill Gates on how to achieve ZERO carbon emissions http://on.ted.com/89Dt Big!"
9240791058,2010-02-17 16:35:00,"RT @tedtalks: ""Adversity isn't an obstacle, it is our lives."" Aimee Mullins at TEDMED. http://on.ted.com/892Y"
9199302597,2010-02-16 20:01:30,"CNN picks 10 #TED speakers as ""fascinating people you've never heard of""  http://bit.ly/9zM1MS"
9198460969,2010-02-16 19:39:03,Clever BBC video: #TED attendees on what the world needs in 18-seconds http://bit.ly/dCUdvq
9198274775,2010-02-16 19:33:48,Fine list of 100 #TED talks by women http://bit.ly/a0qeIV
9197566098,2010-02-16 19:14:15,Is this UK's next Prime Minister?  David Cameron blends technology and behavioral economics at #TED http://on.ted.com/88vB
9193910730,2010-02-16 17:35:14,"""Personalizing a Global Movement""  Thoughtful TED2010 post by Jack Myers http://bit.ly/akzVV2"
9192746899,2010-02-16 17:04:15,Final thoughts on Sarah Silverman at #TED http://bit.ly/cYvc77  &lt;offered with a rue smile and an outstretched hand&gt;
9189123559,2010-02-16 15:30:42,A bookclub in a Nairobi slum http://bit.ly/bx3udc
9189069807,2010-02-16 15:29:23,Congrats @jnovogratz. New York Times bestseller The Blue Sweater is out in paperback today. http://ow.ly/17Mi6
9172114411,2010-02-16 05:04:32,12-year-old Adora was an absolute delight at #TED http://bit.ly/de6qUu
9154276195,2010-02-15 20:14:51,AFP report on last week's #TED http://bit.ly/cyWfKV
9118740993,2010-02-15 00:37:11,Post by @scobleizer on the elephants in the room at #TED http://bit.ly/9eyuwo
9107492541,2010-02-14 18:36:13,More than 300 comments at Reddit on the Bing maps demo at #TED http://bit.ly/a7S2TV
9107264377,2010-02-14 18:28:57,"Massive, massive gratitude to everyone who made TED2010 absolutely unforgettable."
9039139601,2010-02-13 03:12:50,"Evening turned transcendent by David Rockwell, Eve Ensler, Julia Sweeney and Natalie Merchant.  #TED"
9024802262,2010-02-12 20:40:31,Anyone have a question for @billgates on energy?  #TED
9018777222,2010-02-12 17:52:42,"Hats off to the incredible crowd at #TED Active in Palm Springs. So fun seeing you all, this morning."
9018654168,2010-02-12 17:49:29,Speaking from a purely personal point of view... yesterday might just have been my favorite #TED day ever.
9018615857,2010-02-12 17:48:27,Pithy #TED coverage from New Scientist http://bit.ly/bkGJIq
8999889967,2010-02-12 07:51:39,"Jamie Oliver's TED Prize wish: Teach every child about food http://bit.ly/c5asaf  Passionate, persuasive and thrilling."
8999575497,2010-02-12 07:37:42,Some comments I made on what makes a successful #TED talk http://bit.ly/9E1tAK  (illustrated with dreadful pic!)
8981178033,2010-02-11 22:41:11,LXD. Words fail.  #TED
8952800137,2010-02-11 08:11:24,Arianna Huffington: Notes From #TED: Can Simplicity and Innovation Overcome Complexity and Cynicism? http://bit.ly/bqr6c3
8924333440,2010-02-10 23:25:48,"Stand by for killer demo of ""Blippy"" from Pud/Philip Kaplan.  A share-your-credit-card-buys startup, sign of things to come #TED"
8924192755,2010-02-10 23:22:12,Carter Emmart's Virtual Universe is simply jaw-dropping #TED
8923621248,2010-02-10 23:07:45,Watching this session of #TED in simulcast. Camera team doing awesome job. Can't wait to post these talks. ;-)
8923465549,2010-02-10 23:03:52,"Got super-smart advice on #TED's future at lunch from braintrust inc Bill Gates, Larry Page, Jeff Bezos. How lucky is that?!"
8903154728,2010-02-10 14:26:46,"""less annoying than you might think""...  funny #TED curtain-raiser from the WSJ's Kara Swisher http://bit.ly/9ZzEkA"
8902562087,2010-02-10 14:10:28,"I woke up to this email: ""Chris, I saw LXD rehearse. Wow!!!!!!!!!!!!!!!!! (not enuff !s)""  #TED, here we go!"
8878124960,2010-02-10 00:21:27,Sneak preview pics of parts of the TED2010 stage...  http://bit.ly/aqaD24  http://bit.ly/cX05u2
8876714026,2010-02-09 23:44:05,"TED Prize on front page of cnn.com ""Food crusader to reveal secret wish"" http://bit.ly/cIaKem"
8872100717,2010-02-09 21:41:33,Fantastic curtain-raiser for #TED in BusinessWeek http://bit.ly/cQIlkA
8827316777,2010-02-08 22:22:08,"""One wish to change the world"" CNN lays the ground for their coverage of Jamie Oliver  on Wednesday. http://bit.ly/c7Af2M"
8820599209,2010-02-08 19:06:51,Cool new social spaces being built for #TED this week! (pic) http://bit.ly/9zA9v8
8817296530,2010-02-08 17:28:06,Peter Eigen is a planetary hero. How to Expose Corruption http://on.ted.com/87lx  A must-see talk from TEDxBerlin
8813755147,2010-02-08 15:48:55,The mounting rage over Senate dysfunction http://nyti.ms/bPZq42
8812590093,2010-02-08 15:16:48,Beautiful sunny morning in Long Beach.  Gearing up for TED2010 speaker rehearsals on a crazy-beautiful stage...
8744106082,2010-02-07 01:04:51,"If you possibly can, watch the HBO film on #TED speaker Temple Grandin... starting riow in some areas! http://bit.ly/bfT97O"
8733072029,2010-02-06 19:19:02,"Looking out at an amazing construction scene for TED2010: tech domes, a global village, an eco village...  all new this year"
8697359297,2010-02-05 22:58:47,@zigzagflyer only for paid groups. $1k for 10 people. google TED associate membership
8690249459,2010-02-05 19:32:52,We've just booked one final speaker for next week's TED2010. James Cameron. We're thrilled.
8688836685,2010-02-05 18:51:41,"Wow! Right after #TED, LXD will perform for 1 bn people at some award thing...  http://bit.ly/cYza7K  Good luck, guys!"
8685830385,2010-02-05 17:27:23,4 days to go...  Long Beach lays out a TED welcome http://bit.ly/aQlaOs
8681256846,2010-02-05 15:29:11,Artist Tom Shannon battles Parkinsons by painting with a device he invented 2 decades earlier http://on.ted.com/87WV Stunning!
8672609783,2010-02-05 10:59:55,Free maternal advice via sms. text4baby is a great example of a coming wave of 'nudge' policies http://bit.ly/9tOAMG #voxiva
8636494394,2010-02-04 15:38:54,Genius chemist George Whiteside's TEDx talk deserves to hit the front page of digg. http://bit.ly/a5re3l
8636131663,2010-02-04 15:29:17,TEDMED gold. David Agus argues for a powerful new strategy in the war on cancer http://on.ted.com/87PR
8633932329,2010-02-04 14:29:30,Twitter poll: which of next week's speakers http://bit.ly/9v5F6V ...are you most interested to see posted early on ted.com?
8633915541,2010-02-04 14:29:02,TED2010 countdown...  5 days to go.  This is how I felt as a kid every December 20th!
8593768884,2010-02-03 16:28:58,You thought T-Rex was alarming? How about a 45 ft snake... http://bit.ly/aCpECO
8592366387,2010-02-03 15:50:35,A postage-stamp-sized lab! Legendary chemist George Whitesides spoke at TEDxBoston:  http://on.ted.com/87IK
8584643593,2010-02-03 11:55:33,Tech-pessimism. Robert Wright says web-empowerment of activists has made America impossible to govern http://bit.ly/9TgdXn
8566110396,2010-02-03 00:51:27,LOVE this! RT @r_o_y_a_n: Viewed TED talks in class today... Here's our version of the TED Commandments: http://bit.ly/b2MKGq
8556404309,2010-02-02 20:20:58,The start of TED2010 now just one week away. Be still my beating heart!
8547294304,2010-02-02 15:56:01,Stephen Heywood's ALS diagnosis led his brother to a powerful web2.0 idea. A remarkable TEDMED talk http://on.ted.com/87Am
8538711987,2010-02-02 11:24:06,Old people unite! David Brooks says only our elders can fix a financial system stacked in THEIR favor http://bit.ly/bdkoyW
8531815030,2010-02-02 05:56:00,Terry Pratchett volunteers to be a test case for an assisted suicide tribunal http://bit.ly/d8AKVg  Courageous and moving.
8515413237,2010-02-01 21:55:52,Associate memberships flooding in from people who want to watch next week's TED2010 live! http://ted.com/associate
8504114879,2010-02-01 16:18:23,Today's #TED talk. Sendhil Mullainathan applies the tools of behavioral economics to tackling poverty http://on.ted.com/869J
8497465816,2010-02-01 13:03:06,#TED speaker Steve Strogatz has a new regular column in NYT on... wait for it... Math! And it's great!  http://bit.ly/c9yOHy
8455552888,2010-01-31 15:35:28,"@eddireader ""lots of interesting speakers"" at TED. Thanks. But here's a real favorte http://bit.ly/axZrA6"
8455237175,2010-01-31 15:24:58,"""Cynicism is on the wane""?? Did I really say that? I don't think so, though I wish it were true. http://bit.ly/d5jIeX"
8435552103,2010-01-31 02:38:30,"JK Rowling at Harvard on ""the fringe benefits of failure. A #TED best-of-the-web http://on.ted.com/838H"
8416595171,2010-01-30 16:32:34,"Despite my terrible French, I'm enjoying TEDxParis, streaming live http://tedxparis.com"
8416467029,2010-01-30 16:28:39,Masarat is on Twitter... @masarat  - and here's a video about her 8-Day Academy http://www.youtube.com/watch?v=nludz7SgUpU
8416157988,2010-01-30 16:18:57,"""They thought I was crazy"" How Masarat Daud battled the odds to hold a TEDx event at a village in India http://bit.ly/a6DIdW"
8379575366,2010-01-29 18:58:40,TED2010 build-up: many of the speakers are on Twitter http://bit.ly/afyues  ...a merged feed! http://bit.ly/aVEtrI
8372691900,2010-01-29 15:54:28,Ever get lost in Tokyo? A simple-but-endearing 2 min talk by Derek Sivers on cultural differences http://on.ted.com/819X
8369918042,2010-01-29 14:41:36,"We've just opened registration for TED2011 ""The Rediscovery of Wonder"" http://bit.ly/dldUKt  So excited for this."
8327361023,2010-01-28 15:51:55,Today's short #TED talk. A beautiful tale of how smart design is going to save babies lives http://on.ted.com/806K
8299538316,2010-01-27 23:33:46,"RT @Stuart_Anderton: To those saying ""meh"" to the iPad - just wait until the app dev community get going on it..."
8288996394,2010-01-27 18:37:27,Tech-land in a frenzy of ipad glee.  Wall St... not so much. AAPL down $5
8288148585,2010-01-27 18:11:32,ipad it is. I am officially shocked.
8287920804,2010-01-27 18:04:20,Great live coverage of Steve Jobs and the Apple Tablet http://bit.ly/cMgcQj
8285028465,2010-01-27 16:31:47,I'll be shocked if Apple tablet is named ipad - too close to ipod surely. apple islate will become apple is late... hmmmmm
8284406783,2010-01-27 16:12:52,Inside a TED Prize wish: revealing interview with Karen Armstrong on birth of Charter for Compassion http://bit.ly/cH2W4b
8284081490,2010-01-27 16:02:59,"In today's #TED talk the remarkable Eve Ensler advises women AND men: ""Embrace your inner girl"" http://on.ted.com/793R"
8267805200,2010-01-27 05:19:04,Bill on Hans http://bit.ly/7DTh03  RT @billgates Thinking about TED - a favorite talk is Rosling 2007 http://bit.ly/vjKCm
8266982588,2010-01-27 04:51:13,"Gotta love the Reddit community. Their comments about TED much interesting than mine, I think. http://bit.ly/a95rbr"
8244545819,2010-01-26 18:06:11,Congrats @zoecello on (by all accounts) a spectacular performance just now at #TEDxAtlanta Excited by this event
8241569665,2010-01-26 16:40:16,Congressional insanity: a dramatic proposal http://bit.ly/7UKIZ0
8239044055,2010-01-26 15:30:43,"From TEDxSMU, genius architect Joshua Prince-Ramus unveils a theater that remakes itself http://on.ted.com/779R"
8237573096,2010-01-26 14:49:53,Michael Wolff on the Guardian's rise as a global digital brand http://bit.ly/4Wc1l1  Look out NYT and Murdoch!
8233286904,2010-01-26 12:31:03,I just ordered Seth Godin's major new book out today. Linchpin: are you indispensable? http://bit.ly/6DH4TY
8204900120,2010-01-25 20:06:09,Which #TED speakers blew it? + 9 other questions upvoted by Reddit. My answers: http://on.ted.com/767H
8199584076,2010-01-25 17:25:54,Me too! RT @billgates @TEDchris thanks for reading the annual letter - looking forward to the upcoming talk at TED2010...
8197937092,2010-01-25 16:38:43,How your health is impacted by where you live. Another excellent TEDMED talk  http://on.ted.com/763W
8190002251,2010-01-25 12:36:00,Italy's African immigrants battle the mafia. Eye-opening essay. http://bit.ly/8prfrz
8181906604,2010-01-25 06:05:47,The one-cubic-foot-of-life project by photographer David Liittschwager http://bit.ly/5eCjXP Stunning!
8180136883,2010-01-25 05:00:05,"GM crops, vaccines, circumcision, and a smack-down for Berlusconi: highlights of the new Gates letter http://bit.ly/6z0aoa"
8170443663,2010-01-25 00:44:33,Venezuela's revolutionary El Sistema orchestral movement coming to US. A TED Prize wish in progress http://vimeo.com/8269752
8124093192,2010-01-23 21:15:43,"A 3-min knockout from Taylor Mali on ""What Teachers Make"" http://on.ted.com/741Q  #TED Best of the Web"
8124011744,2010-01-23 21:12:50,"Exciting science lecture from a (much younger) Richard Dawkins. ""Best of the Web"" at #TED http://bit.ly/5UzJm9"
8090472902,2010-01-23 00:15:02,Enjoyed Aardvark's Damon Horowitz talk streamed from #TEDxSoMa. Philosopher/entrepreneur creates new approach to search
8078097291,2010-01-22 17:50:49,Hell hath no fury...  http://digg.com/d31GRpK
8076666634,2010-01-22 17:09:30,RT @timoreilly: Pop Sci article about Pixel Qi: The LCD Screen That Could Finally Kill Paper For Good  http://bit.ly/7swOJi
8076615845,2010-01-22 17:08:02,An ambitious TEDx event with great speakers + free live-stream kicks off at 1pm US PT.  Check out http://tedxsoma.com
8072765628,2010-01-22 15:20:31,Astonishing percussionist Sivamani finds rhythm in everything. 16 minutes of exhilaration http://on.ted.com/725S
8072347980,2010-01-22 15:08:53,"Here's an underused, but easy way to find the #TED talks that interest you: Tags. http://www.ted.com/talks/tags"
8067199587,2010-01-22 12:19:34,At 6am today I found myself shedding tears at the end of John Hodgman's genius tale of aliens and love http://bit.ly/5vSMNp
8031123622,2010-01-21 15:40:20,Engineering human organs. An astounding talk from TEDMED. http://bit.ly/6h5fX9 At 11:00 a desktop printer creates heart tissue!
8027277062,2010-01-21 13:41:51,Nature never ceases to amaze. Turns out red grouper can sculpt the sea-bed into complex 3D structures http://bit.ly/5ZbSFA
8024016312,2010-01-21 11:36:01,Exploding Haiti myths. Nick Kristof on fire today http://bit.ly/7aA5xD
8004639678,2010-01-20 23:33:24,"I hear  James Randi is preparing an ""expose"" of David Blaine's breath-holding world record following his #TED talk. Look out!"
7989090690,2010-01-20 15:28:41,"Today's #TED talk: 10 Indian artists to watch: http://on.ted.com/698F Crisp, clear with beautiful images, all in 6 mins"
7988369426,2010-01-20 15:07:00,Welcome to Twitter @billgates  190k followers on your first day? Wow. No pressure then! Looking fwd to your talk at TED
7956493656,2010-01-19 19:27:43,"David Blaine's breath-holding insanity not exactly an idea worth spreading, but his determination is http://on.ted.com/680Z"
7956444954,2010-01-19 19:26:05,Delighted by our new partnership with TEDMED. It will bring amazing talks to TED.com http://bit.ly/6RnyXV
7947464210,2010-01-19 14:43:51,Our first TEDMED talk about to post. It's a biggie. Follow @tedtalks
7941778116,2010-01-19 11:12:03,Incredible --&gt; http://twitpic.com/yrl7w  A TEDx event held today in an Indian village against all odds by amazing @masarat
7941596358,2010-01-19 11:03:13,Is biophilia the true secret to Avatar's success? http://bit.ly/4oY6ZK
7925665114,2010-01-19 00:49:47,Somehow I've ended up on the front page of Reddit. I'll be giving some answers at the end of the week! http://bit.ly/72PMO8
7908313622,2010-01-18 15:56:58,Know someone remarkable who should come to TEDGlobal in July? Applications for fellowships now open http://bit.ly/7TKmuw
7906472796,2010-01-18 14:59:40,"To mark Martin Luther King day, we've posted his world-changing ""I have a dream"" speech at #TED http://on.ted.com/663E"
7833904584,2010-01-16 18:05:22,"Interesting take by Karabell on Google and China. ""Silicon Valley Is No Longer King""  http://bit.ly/7MaAi0"
7794463692,2010-01-15 17:10:58,Stamps? Moleeds??!  Charles Fleischer's #TED talk is pure comic genius http://on.ted.com/636Y
7790333145,2010-01-15 15:07:20,"Doomsday deferred. ""Nuclear war now a lesser threat than global warming""  http://bit.ly/4vKGua"
7764231773,2010-01-14 22:36:42,This moved me. Readings by Haitian author Edwidge Danticat during an earlier humanitarian crisis http://on.ted.com/629L
7754565092,2010-01-14 17:16:23,How to help Haiti  http://on.ted.com/626X
7753069563,2010-01-14 16:29:00,RT @ushahidi: Pass this on.  Missing persons registry for #haiti is http://www.haitianquake.com
7753011927,2010-01-14 16:27:10,"This appears to be a superb guide to earthquake relief, pooling learning from multiple agencies http://bit.ly/7yFd4w #Haiti"
7746091415,2010-01-14 12:33:10,How an open-tech platform built in Kenya has been used for Haiti http://bit.ly/6xc26V  Background http://bit.ly/6Vb7NT
7735075483,2010-01-14 03:52:01,Crowd-sourced info is becoming powerful resource in Haiti crisis http://haiti.ushahidi.com
7733390590,2010-01-14 03:00:36,@WaterBrick Is your product potentially valuable for Haiti? pls email me chris@ted.com
7732162995,2010-01-14 02:25:27,"TED has been asked by govt to help find best tech solutions for aiding Haiti. If you have suggestions, email chris@ted.com  pls RT"
7719804016,2010-01-13 19:55:10,What causes killer quakes? Sick/mad Pat Robertson says Haiti ‘swore a pact to the devil’ http://bit.ly/8re5Aq
7707328152,2010-01-13 13:09:28,Google China currently http://bit.ly/4pmWfs vs Google US http://bit.ly/7OnS8T ...and a brave decision http://bit.ly/5CzVci
7694645129,2010-01-13 03:00:56,The world seems to want new ideas.  200 million #TED talks have now been viewed online  http://bit.ly/8kl0sQ
7679361702,2010-01-12 19:19:17,"Rave reaction on Facebook http://bit.ly/5ePYo1 to Kiran Bir Sethi's #TED talk teaching kids ""I can"" http://on.ted.com/598R"
7632826089,2010-01-11 15:30:17,Good news dept? RT @bbcbusiness: Oil prices hit a fresh 15-month high of nearly $84 a barrel http://bit.ly/57BzJc
7632757768,2010-01-11 15:28:06,A tale of hope. How the centuries-old cruelty of dancing bears was ended http://on.ted.com/585S  Short #TED talk
7627721755,2010-01-11 12:26:24,Privacy comments by Facebook's Zuckerberg stirring up a storm http://bit.ly/8HiOFM  http://bit.ly/7aEK4y
7627169489,2010-01-11 12:01:07,Unique human traits aren't what you think. Robert Sapolsky's best-of-web talk is a must-see http://on.ted.com/583S
7602863961,2010-01-10 20:04:24,RT @LenKendall: A great write up by @luckthelady about how TED talks make us feel: http://bit.ly/6x5o0k
7592772944,2010-01-10 13:38:22,Astounding solar deal in China http://bit.ly/8Qx7KM  Friedman's take http://bit.ly/4u50Xr  Started smaller! http://bit.ly/50Hr55
7561017167,2010-01-09 16:16:28,With his famous 'last lecture' Randy Pausch gave the world an incredible legacy. So happy it's now on TED http://on.ted.com/558M
7560578803,2010-01-09 16:00:55,Congrats and thanks to @brainpicker  RT @veselin_vasilev TEDxBG was awesome
7560346050,2010-01-09 15:52:34,"3 terrific new ""best of web"" talks at http://ted.com  Robert Sapolsky, Matt Weinstein  ...and Randy Pausch's last lecture"
7533638684,2010-01-08 21:51:41,"Do you know a superb, organized office and HR director? TED is calling! http://ted.com/pages/view/id/194"
7521236866,2010-01-08 15:06:45,Jazz legend Herbie Hancock and his all-star band light up #TED http://on.ted.com/546Z
7517996717,2010-01-08 13:19:11,...and 2 more excellent EDGE essays: Matt Ridley http://bit.ly/5WNdte  and Kevin Kelly http://bit.ly/82t9a5
7517962919,2010-01-08 13:17:57,Two insightful EDGE essays today: June Cohen http://bit.ly/4Nm9rP  David Eagleman http://bit.ly/7tpezV
7517126376,2010-01-08 12:45:32,The rediscovery of fire: my EDGE essay suggests a primal reason why talks are spreading online http://bit.ly/8mcGbF
7516860231,2010-01-08 12:34:33,How is the Internet changing how you think?  EDGE's superb 2010 essay collection goes live http://bit.ly/8nQOnK
7482696736,2010-01-07 15:52:33,Watch Romulus Whitaker and his Incredible work with cobras and gharials in today's #TED Talk http://on.ted.com/535W
7475240748,2010-01-07 10:57:37,30 mad days of design exploration. Love it! RT @Palomar5 in 2009 - The movie: trailer now online: http://bit.ly/4wxXG7
7444599651,2010-01-06 15:52:54,"9 habits for a long, healthy life. Dan Buettner's terrific talk from TEDxTC http://on.ted.com/521P"
7438243906,2010-01-06 11:47:41,Holy dinoflagellates! Fabulous article on an astonishing micro-organism that could save the coral reefs http://bit.ly/5R90Ll
7408351694,2010-01-05 16:49:33,Amazing giant x-ray images in today's #TED talk from Nick Veasey http://on.ted.com/511D
7400142974,2010-01-05 10:58:29,David Brooks' bleak op-ed suggests it will be the tea-party decade http://bit.ly/6j6K2O Surely America can do better?
7377949819,2010-01-04 20:29:32,How to tweet a TED talk http://bit.ly/4IMtV8
7369445314,2010-01-04 15:11:19,Terrific #TED talk today: VS Ramachandran on how human mirror neurons helped launch civilization http://on.ted.com/495Y
7331962239,2010-01-03 13:24:32,Bono's delightful (and surprising) list of ideas for next decade http://bit.ly/7FQodq
7229048874,2009-12-31 09:29:36,Nostalgia ain't what it used to be.  Dan Gilbert in the NYT http://bit.ly/6z2841
7165945915,2009-12-29 17:46:00,"Outside TED, what's the best talk you've seen on the web?  (we want to add to our new library of ""best of the web"")"
6979215454,2009-12-23 22:46:25,"Q and A added to Shaffi Mather's idea for a new bribery-busting business, showing how it could work. http://on.ted.com/385I"
6978737488,2009-12-23 22:28:33,Explanation of our new TED.com feature: Best-of-the-Web http://bit.ly/59FC9n
6977951957,2009-12-23 21:58:32,"Steve Jobs inspiring commencement speech at Stanford now up at #TED http://bit.ly/6PmpOb  part of  ""best of the web"""
6977792442,2009-12-23 21:52:18,"We're just launched a feature at http://TED.com I'm really excited about. ""Best of the web"" = great talks from elsewhere. 3 up!"
6968958832,2009-12-23 16:24:00,Chuckle... RT @EmilysPearl You know how some people marry for green cards? I would marry for entry to TED 2010 #serious
6967132151,2009-12-23 15:22:05,Seeing the world through different eyes. I powerful talk at #TEDIndia by Pakistani Asher Hasan  http://on.ted.com/402F
6962104376,2009-12-23 11:52:39,Teacher Larry Ferlazzo shares the #TED talks he uses in class.  Thoughtful list! http://bit.ly/4mPKpN
6945755978,2009-12-22 23:36:11,Here it is! the TED2010 speaker line-up http://bit.ly/6qJbvV
6904783527,2009-12-21 20:44:31,Delighted to announce chef Jamie Oliver as winner of the TED2010 TED Prize http://bit.ly/7W8e8Q
6897129988,2009-12-21 16:03:18,Today's #TED talk: Entrepreneur Shaffi Mather unveils a courageous corruption-busting idea http://on.ted.com/385I  Love this!
6786333772,2009-12-18 04:07:16,Has dark matter finally been detected? http://bit.ly/6QS2lz
6766791319,2009-12-17 15:48:41,Today's #TED talk begins with a puzzle about dragonflies... a delightful tale of science in action http://on.ted.com/355Z
