609028976544202753,2015-06-11 16:06:37,Can you handle a challenge to your deepest assumptions about reality?  Don Hoffman will do that. Love this talk! http://t.co/iqPPmxmwJn
608293589135847425,2015-06-09 15:24:27,"The amazing Sarah Jones stars in today's TED. Hilarious, powerful sex lesson from the future! http://t.co/zqqRNJX77Q"
606528150600876033,2015-06-04 18:29:14,"Courageous, shocking talk from @TrevorAaronson on the FBI's ""anti-terror"" strategy that's backfiring http://t.co/eSI92T47XR"
606046438854950912,2015-06-03 10:35:05,"After FIFA clean-up, what football/soccer needs most is challenge system for review of poor ref calls. Please??!! http://t.co/x76DzU9Nly"
605787256670973953,2015-06-02 17:25:11,Blatter's resignation has uncorked a river of Twitter love from around the world toward... the USA and the FBI. Did not see that coming!
605395228275712003,2015-06-01 15:27:24,Timing REALLY matters! Terrific short talk from @Bill_Gross on what it takes for a start up to succeed. http://t.co/w43vDccnU9
605384213949497344,2015-06-01 14:43:38,"Geniuses @Jonatron_Jon @LaurentDelaigue &amp; @Gnatta 1st to solve it.  ARCHEOZOOLOGIES (scores 30x3x3x3) + PIXIES, QUANTA, LIDO + 50 = 865"
605382718638145536,2015-06-01 14:37:42,"@Gnatta You nailed it!  2nd person, I think."
605382145079689216,2015-06-01 14:35:25,@Jonatron_Jon  Bingo. You win. That was fast!
605381781588717568,2015-06-01 14:33:58,Correction. 965 points. Hint. Need to place all 7 letters in a single 15-letter word!
605381435516690433,2015-06-01 14:32:36,@JakeAchterhoff That's part of it. keep going. need to place all 7
605380778621550592,2015-06-01 14:29:59,Looks like a terrible Scrabble hand OOOIASC. But it can be played here to score 915 points! Who can spot how? http://t.co/mygf78dV20
605377155611127808,2015-06-01 14:15:35,Colin's piece incredibly generous. Can't wait to catch up w everyone. https://t.co/bQ17EOsRGn
601430060206260224,2015-05-21 16:51:15,Certainly made me smile! https://t.co/w7Pc7JASEJ
601403980808355841,2015-05-21 15:07:37,"Remarkable talk on infidelity http://t.co/2uqUCoH5L9 Thank you, @EstherPerel"
600747470423855107,2015-05-19 19:38:52,"Recommended read: Team of Teams by General @StanMcChrystal. Humble, insightful lessons of leadership. http://t.co/uVKpYveJuq"
600323281934233600,2015-05-18 15:33:18,It was such an honor to interview one of the world's most remarkable people Martine Rothblatt. http://t.co/9iBlM82GIh What a life!
599659093377175553,2015-05-16 19:34:03,"If your family got access to electricity for the first time, what would you use it for? http://t.co/Sg0nFuhOSF"
599248714297909248,2015-05-15 16:23:21,This song by 9 women jailed for life is the most moving thing I've seen in a long time http://t.co/8U5VYj2pE6 Please share.
598876159246491648,2015-05-14 15:42:57,You have to watch this brilliant live podcast by @RomanMars - coolest TED Talk on design ever given?! http://t.co/7NTnbgLBXJ
598806399083270144,2015-05-14 11:05:45,"@st3ph007 Thanks, Steph. Well, here's one. http://t.co/A9JPiUg40e"
596395785052356608,2015-05-07 19:26:50,"Abe Davis is doing a Reddit AMA on his amazing video technology  http://t.co/EA48YaB5xa (Oh, and there's a new vid demo there. ha ha!!)"
595983671305314304,2015-05-06 16:09:14,The iconic dancer Bill T Jones with an unforgettable moment of improvisation.  6 mins of magic http://t.co/y4lERLw6ma
595616664684785665,2015-05-05 15:50:53,RT @Acumen: Acumen is excited to announce our expansion into Latin America and announce our first investment! http://t.co/0YQkQtg9Lq #Acume…
595613372911132672,2015-05-05 15:37:48,Today's TED Talk unveils an astounding technology. Video can reveal an object's INTERNAL structure &amp; nearby sounds! http://t.co/m8rsuUgBgC
595242752998252544,2015-05-04 15:05:06,"Even though I only met him a few times, the death of @davegoldberg has really got to me. Life is too fragile. Lost for words."
594162808406835200,2015-05-01 15:33:47,"College or prison. Two roads, one searing injustice. Please watch and share Alice Goffman's incredible talk http://t.co/ejzg9EFDlk"
594147769004269568,2015-05-01 14:34:01,"We're about to post a talk that is one of the most heartfelt, and heartbreaking, arguments about injustice I've ever heard. Stand by!"
593939858499973121,2015-05-01 00:47:51,You can't watch this talk without a) giggling uncontrollably b) learning just how WEIRD laughter is! http://t.co/Ns6gYyVnw1
593926094220197889,2015-04-30 23:53:10,My 2-minute take on @elonmusk http://t.co/r0BVqABCLE
593181830314106880,2015-04-28 22:35:43,So powerful! https://t.co/G4RnUddyT8
592710727699460097,2015-04-27 15:23:44,Nick Bostrom on the peril of coming super intelligence. Watch and share! http://t.co/KHNOavOs7v
592646777322471424,2015-04-27 11:09:37,How lucky am I that a woman as courageous and eloquent as @brosandprose works at TED? This interview is astounding http://t.co/aXGeD0xV5T
591871785320194048,2015-04-25 07:50:04,@RobJCast thanks for sharing. Crazy beautiful!
591871339801255936,2015-04-25 07:48:18,RT @RobJCast: @TEDchris How I proposed to my girlfriend during my TEDxUF talk http://t.co/K4mRxEktEF
590894817548304384,2015-04-22 15:07:57,A new driver of human connection? @chris_milk demos an incredible new use of VR  ...as EMPATHY MACHINE. http://t.co/keiZFsGEad Love this!
590881540407713793,2015-04-22 14:15:11,@RichardSJust @BillGates Corrected. Thanks. http://t.co/QhtlwLjBF1
590881406533967872,2015-04-22 14:14:40,Exciting to see @billgates support for http://t.co/tEflocx3mi  gaining massive traction. I've joined too. You? http://t.co/QhtlwLjBF1
590575177227964417,2015-04-21 17:57:49,"I'm biased, but TED Fellows inspire me. They just do. Here's @JedidahIslerPhD and her love affair w the universe! http://t.co/A6wifiYBAC"
590186325816532992,2015-04-20 16:12:39,Blockbuster TED Talk by @GaryHaugen. http://t.co/IBMkhJg9yP  His explanation of the dark hidden cause of poverty is unforgettable.
589958325489373184,2015-04-20 01:06:40,"@myers_mel thanks, Mel... Generous."
589957403132563456,2015-04-20 01:03:00,"On 60 Minutes, the impact of TED Talks http://t.co/u4b5LSU9Up via"
589955868751331328,2015-04-20 00:56:54,RT @60Minutes: TED Talks: @CharlieRose reports on one of the Internet's most powerful platforms http://t.co/pEqhOwKmMI http://t.co/v2ind4dN…
589091556310851584,2015-04-17 15:42:26,The Global Citizen open-air concert in DC tomorrow looks s-p-e-c-t-a-c-u-l-a-r !  https://t.co/kBZuC33QWU
589088698609840130,2015-04-17 15:31:05,"RT @D_Dobbie: #TED 60 Minutes previews “TED’s excellent adventure” - On Sunday night, 60 Minutes will take a look at what they... http://t.…"
589031428479983616,2015-04-17 11:43:30,CBS just announced they're airing a segment on TED this Sunday on 60 Minutes. Fingers crossed...!
588741934975492096,2015-04-16 16:33:10,"When a Wall Street star like Paul Tudor Jones calls for a rethink on capitalism, it's worth paying attention http://t.co/j1B7wwRU0c"
588423673939419141,2015-04-15 19:28:30,The ingenious startup offering low-cost way to keep babies warm @embracewarmer is now on Kickstarter. Do support! http://t.co/jeKUNjOyJy
588393420298780672,2015-04-15 17:28:17,"RT @FreedomForAllfn: ""In order to make the world a better place, it has to start with you."" - @ZakEbrahim  #SkollWF"
588391820100509697,2015-04-15 17:21:56,Well said! https://t.co/5Ws8PKtE7i
588391555649687552,2015-04-15 17:20:53,Such a treat to listen to some of my heroes at Skoll World Forum http://t.co/Ry7zGxFoCn
588390961950150656,2015-04-15 17:18:31,RT @zanne2: I could listen to  @TheDesmondTutu and @jnovogratz all night and all day #SkollWF @SkollWorldForum #trueleaders http://t.co/92Y…
586842224706596864,2015-04-11 10:44:24,"@ZZAPRRAP Goodness. That was a whole other life.  Fun days, though. The precursor to Future Publishing...."
586841558374309888,2015-04-11 10:41:45,"RT @ZZAPRRAP: 30 years ago today, Zzap!64 was born!! Happy Birthday Zzap. What do you think of that @TEDchris ? http://t.co/5lNVaz1bUu"
586190124788162560,2015-04-09 15:33:11,The Rosetta mission to land on a comet captured the world's imagination. Here's the inside story http://t.co/8XI6F0HEqR
584367819850063874,2015-04-04 14:51:59,RT @TheEconomist: When the Millennium Development Goals were adopted they seemed Utopian. Which did some good? http://t.co/EJZWEq0I2W http:…
584336902263668736,2015-04-04 12:49:08,"""When I despair, I remember... there have been tyrants and murderers... but in the end, they always fall.” Mahatma Gandhi  #KenyaAttack"
584332732970377216,2015-04-04 12:32:34,RT @gatesfoundation: All lives have equal value—we're teaming up with Global Citizen --&gt; http://t.co/29Yxdo6gKo http://t.co/N3oMgezPlI
584332515113971712,2015-04-04 12:31:42,11 up-and-coming scientists you need to know... http://t.co/dFQN1RZbo9
584018430803709952,2015-04-03 15:43:39,RT @emeka_okafor: The day I stood up alone http://t.co/SPJcuERMAe
584017956465680384,2015-04-03 15:41:46,Another powerful TED talk from @billgates. We're not ready for the next disaster...  http://t.co/0AhT4xL8xo
583985712149598209,2015-04-03 13:33:38,"Didn't see that coming. People are using the beautiful new StoryCorps app to create ""audio selfies"" http://t.co/ayJTfd9mJI Nice!"
583285443455795200,2015-04-01 15:11:01,Former Aus PM @MrKRudd on how US/China relations cd be transformed for a safer future for all of us http://t.co/d7EqrJDaIX #TED2015
582929867492233216,2015-03-31 15:38:05,"The amazing Daniel Kish, a real-life echolocating 'bat-man', brought the TED audience to its feet.  http://t.co/fGDcSqAgV8"
582575936660463616,2015-03-30 16:11:41,Behind every rise: accompaniment. http://t.co/XuZVtns1zw Beautiful concept. Who's been your accompaniment? And who have you offered it to?
582574584416849921,2015-03-30 16:06:19,"""I sometimes get sick of myself."" Beautiful piece by @courtneywrites on need to dehabituate! http://t.co/N35oTxRRAO http://t.co/ArF0V80Vyz"
581474580327346176,2015-03-27 15:15:17,Why do ambitious women have flat heads?! Unforgettable TED Talk by the incomparable Dame Stephanie Shirley http://t.co/nrhuvfqEWg
581136780503748608,2015-03-26 16:53:00,"@jakehawkes42 Jake, I get your annoyance. But are you saying the 150k others who will die today are not innocent? Death sucks. All of it."
581130674184327168,2015-03-26 16:28:44,@sredlums The families of many of the other 150k who will die today will feel the same grief. We focus on the dramatic over the fixable.
581130083982774272,2015-03-26 16:26:23,@paintedbird fair point. but as a world we lack compassion for the countless invisible deaths we choose to ignore in favor of the dramatic.
581114322908246016,2015-03-26 15:23:45,"How Theaster Gates is unleashing the power of design, art, culture in South Side Chicago http://t.co/NtvUVYlDbj"
581112002887716866,2015-03-26 15:14:32,"@InsiderThreats ""There is a LOT of tragedy every day""  I think that was my point. We tend to focus only on the dramatic."
581087922876727297,2015-03-26 13:38:51,@webpointzero It is. But I bet there are stories in the other 150k deaths yesterday that also deserve attention. we lean to the dramatic
581087614306009088,2015-03-26 13:37:37,"@getoffyourknees Not intended that way, John. That crash a tragedy. But we ignore so many other things we cd fix because there's less drama"
581087361142022144,2015-03-26 13:36:37,"@moneyries Yes, it is. But you think there aren't stories in the 150k other deaths? We lean to the dramatic. And ignore stuff we cd fix."
581083791684464640,2015-03-26 13:22:26,"@mikebrondbjerg you miss my point, pal. it's a tragedy. but there are countless other tragedies we could fix that go ignored. That's all."
581078558984011776,2015-03-26 13:01:39,"150,000 people die each day. But if 100 die in an airplane it hijacks world's attention for weeks. Here we go again... #BrainBug"
580822798521757696,2015-03-25 20:05:20,200 pics from #TED2015 in under 3 mins https://t.co/RXZG7u5t3R
580751581714497536,2015-03-25 15:22:21,Incredible talk &amp; wish from 2015 TED Prize winner @DaveIsay. Pls share far &amp; wide! http://t.co/dcGo7aEUoK http://t.co/tZexZISahP
580457989892677633,2015-03-24 19:55:43,"Spot the addition to the top-level menu of AppleTV !  Yes, we're quite happy about this. ;-) http://t.co/V7YQRxkR7R"
580391436971048960,2015-03-24 15:31:16,I urge you to watch this astonishing TED Talk by @AnandWrites Will rewire how you think of America. http://t.co/xI0joUIf6Q
580356776010362880,2015-03-24 13:13:32,Insightful recap of #TED2015 from @recode http://t.co/eEMN3NXyd0
580183145619812352,2015-03-24 01:43:35,I've preordered my copy of Becoming Steve Jobs. A legacy at stake... http://t.co/379npPeOzX
580179290924404737,2015-03-24 01:28:16,"Mars, coral and cassava. The best science at #TED2015, according to Scientific American.  http://t.co/C37jP14FfZ"
580024410070876160,2015-03-23 15:12:50,AI pioneer Fei Fei Li is using a massive image bank to teach computers to understand pics http://t.co/4JyevxElX4 Killer talk. #TED2015
579722658356420608,2015-03-22 19:13:47,#TED2015 picture highlights https://t.co/ylAFFAPpaN Won't forget this one easily....
579333478329659393,2015-03-21 17:27:19,"Hope. RT: @TheEconomist Islamic State is losing ground, money and the consent of the people it rules http://t.co/OoUa0v0JGo"
579332781538299904,2015-03-21 17:24:33,"RT @BenedictEvans: In tech, it's normally a very bad idea to have a strong view on a transformative experience that you haven't actually ex…"
579332651284176896,2015-03-21 17:24:02,"Wow, great find: MT @jhagel Unbelievable, uncanny, and sometimes unnerving images from biological science.. http://t.co/5kCd3tsAfg"
579332017277444096,2015-03-21 17:21:31,"RT @lakshmipratury: ""Keeping up with the Joneses"" has a whole new meaning when you are between Sarah Jones and Bill T. Jones #TED2015 :-) h…"
579324651282653184,2015-03-21 16:52:14,RT @Bill_Gross: Here are the top 10 things I learned @ #TED2015 Feel free to share &amp; would love your feedback https://t.co/JaZmuUKggW http:…
579324353403179008,2015-03-21 16:51:03,Powerful debut on Medium by @jnovogratz on how hidden heroes in Pakistan can unlock the country's potential http://t.co/X5J8PRFeIW
579088556976533505,2015-03-21 01:14:05,RT @MonicaLewinsky: gratitude to @TEDchris and the TED Family- both staff and attendees- for an incredible week. such a privilege. thank yo…
579088390701764610,2015-03-21 01:13:25,Bravo to @MonicaLewinsky for turning her story into a force for good. Her #TED2015 talk is live http://t.co/iRQLf7fPa8
579003634463035392,2015-03-20 19:36:38,"RT @MelanieLeGrande: Great final session at #TED2015 - ""can we learn to live well because of death and not in spite of it?"" Lots to ponder.…"
578998878852108289,2015-03-20 19:17:44,"Thank you all for an amazing week at #TED2015! So many extraordinary people have shared their ideas. Feeling inspired, humbled, awed."
578992303097847808,2015-03-20 18:51:36,RT @mitchjoel: BJ Miller just did for healthcare and hospitals what Sir Ken Robison did for education and schools. Transformative. #ted2015
578991862440030208,2015-03-20 18:49:51,"RT @orientalist: Let death be what takes us, not lack of imagination! #TED2015  @zenhospice so moved. So inspired."
578987440037203969,2015-03-20 18:32:17,"How can we bring more intention, creativity, and quality of life to the process of dying? Such an important talk from BJ Miller. #TED2015"
578983590504980480,2015-03-20 18:16:59,"Had the privilege of interviewing the @DalaiLama &amp; thrilled to share our conversation at #TED2015 today. A wise, compassionate man."
578982487604375552,2015-03-20 18:12:36,.@ellenmacarthur sparking a powerful conversation at #TED2015. Bold vision for a circular economy that uses things instead of using them up.
578979800867426305,2015-03-20 18:01:56,Powerful talk about transforming anger into creative solutions and action. @k_satyarthi has led quite an extraordinary life. #TED2015
578977982036873216,2015-03-20 17:54:42,RT @deehallmendes: What a treat to wrap up the conference with a powerful performance from the amazing @aloeblacc at #TED2015 http://t.co/2…
578731977395855360,2015-03-20 01:37:10,.@EstherPerel brilliantly reveals how infidelity is both the ultimate betrayal...and something that can help a marriage start again #TED2015
578721535835398144,2015-03-20 00:55:40,"Survivors of human trafficking have suffered greatly, dared greatly. Powerful talk by journalist Noy Thrupkaew. #TED2015"
578702759769169920,2015-03-19 23:41:04,RT @debbyruth: Very impressed w/Monica Lewinsky &amp; her important and brave talk at #TED2015 #upstander
578702563710611456,2015-03-19 23:40:17,RT @monicabyrne13: so inspired by @romanmars talk I immediately scribbled down a flag design idea for #Durham #TED2015 http://t.co/grfgBAz3…
578702245589483521,2015-03-19 23:39:01,"RT @kiddocjana: MIT Media Lab's Neri Oxman just made my brain explode with her mashup of bio, tech, material science, shrimp and high fashi…"
578687810447765504,2015-03-19 22:41:40,"Dustin Yellin.. what an artist! His Pioneer Works in Brooklyn pulls in artists and scientists in an insanely cool, creative space #TED2015."
578683188505096192,2015-03-19 22:23:18,"Neri Oxman's design projects tap into nature's wisdom. Fascinating possibilities for fashion, architecture, engineering. #TED2015"
578672415418515456,2015-03-19 21:40:29,"Fun crash course from @romanmars: If you understand good flag design, you can understand the design of anything. #TED2015"
578671547923087360,2015-03-19 21:37:02,Insightful NYT article on how Monica Lewinsky found the courage to begin speaking out http://t.co/NXoPIRufD2
578669350371991552,2015-03-19 21:28:18,What if 3D printing were 100x faster?  An incredible demo from #TED2015 http://t.co/kDqnU52TtD
578668499800707072,2015-03-19 21:24:56,RT @melindagates: One of the most inspiring talks from #TED2015 was from cancer doctor Siddhartha Mukherjee: http://t.co/m4DGanynz8 http://…
578668130282565632,2015-03-19 21:23:28,"RT @sallykohn: Oh my heavens, every time I see @jonesarah I remember all over again how utterly amazing she is. 

#TED2015 #TEDActive"
578667867219976192,2015-03-19 21:22:25,RT @ToEllen: I'm reeling in a good way from the most powerful session I've experienced in 10 years of coming to #TED #TED2015 http://t.co/g…
578667754489659392,2015-03-19 21:21:58,RT @IJM_PhilReilly: From bullying to everyday violence to sexual exploitation to incarceration to justice - an incredible morning session o…
578650040366997506,2015-03-19 20:11:35,This group just delivered one of the most powerful TED sessions ever. #TED2015 http://t.co/f3TiC4Pjse
578641971104858112,2015-03-19 19:39:31,Inspired by Rev. Jeffrey Brown's work. Amazing things happen when you listen to people and allow yourself to change with them. #TED2015
578629247465603072,2015-03-19 18:48:57,"Based on this preview, the new one-woman play from @jonesarah BUY/SELL/DATE is going to be a smash hit. #TED2015"
578618073298690049,2015-03-19 18:04:33,I was blown away @GaryHaugen's book The Locust Effect. His powerful message: the hidden cause of global poverty... VIOLENCE. #TED2015
578610486113148928,2015-03-19 17:34:24,I'm impressed by the courage it's taken @MonicaLewinsky to come to the #TED2015 stage for an important talk on online harassment.
578445906464280576,2015-03-19 06:40:25,"RT @stevesilberman: The whole @PopUpMag crew was so wonderful at #Ted2015. Deep, humane, haunting, nuanced stories. Honored to be a part of…"
578444090175463424,2015-03-19 06:33:12,"RT @jason_pontin: Kudos to @TEDchris for inviting the plant geneticist Pamela Ronald to speak at #TED2015, and amplifying a science-based a…"
578438647885627392,2015-03-19 06:11:35,"RT @cindygallop: That was a deeply moving, profoundly saddening @TEDtalks from @sukisworld. Buying her book now. #TED2015 #TEDActive #TED"
578438500833308672,2015-03-19 06:11:00,"RT @brainpicker: Two of our era’s greatest cultural institutions of storytelling, together – so glad to see @PopUpMag and @TEDTalks join fo…"
578354517546180608,2015-03-19 00:37:16,"Excited to welcome guest curators, @PopUpMag, bringing a new style to the TED stage. We're in for a treat! #TED2015"
578310598884245504,2015-03-18 21:42:45,Biggest threat in the coming decades? A microbe. @BillGates calls on us to improve global health now. Important message. #TED2015
578307609100361728,2015-03-18 21:30:53,RT @shovan3112: Attended @TEDTalks for the 1st time..awestruck by the kind of research going on in diverse fields.. #Ted2015 #TedxKormangala
578295832270671872,2015-03-18 20:44:05,RT @sousatweets: Bill T. Jones surprise performance on the #TED2015 stage. Woweeeee wow wow that was something.
578291538905550848,2015-03-18 20:27:01,RT @shivsiroya: @StoryCorps is powerful. Thankful to have done an interview w/ @NeginFarsad - amazing what you discover. Everyone should do…
578285972036538369,2015-03-18 20:04:54,"RT @marynmck: Phew! Offstage after terrifying, thrilling time onstage at #TED2015. Thanks @TEDchris for opportunity and whole team for amaz…"
578273823843291136,2015-03-18 19:16:38,"Abandoned homes are an artistic opportunity, says Theaster Gates. His projects are breathing new life into Chicago. #TED2015"
578273642410348544,2015-03-18 19:15:54,"Tree of life should be shown as a web-like network instead, says @mslima. Great way to represent our interdependency. #TED2015"
578270796814159874,2015-03-18 19:04:36,Legacy TED speaker @RichardStJohn returns for an audience talk. Always glad to have him back! #TED2015
578262035596709888,2015-03-18 18:29:47,Stunning bamboo homes by @elorahardy... what other sustainable materials could we use to build next? #TED2015
578258575635673088,2015-03-18 18:16:02,Tip from @tfadell: The best designers notice and improve little details that others overlook. First step: noticing! #TED2015
578233088431550464,2015-03-18 16:34:45,"Steven Wise fights for animals to have legal rights like humans do. He was inspired, as I was, by Peter Singer's Animal Liberation #TED2015"
578230437039882240,2015-03-18 16:24:13,First talk from #TED2015 is live!  @davideagleman explores the incredible possibility of brand new human senses http://t.co/8zyQ9K3EeN
578227045035065344,2015-03-18 16:10:45,"Overusing antibiotics could put us all in danger of dying from simple infections, says @marynmck. Time to listen up. #TED2015"
578217313478045696,2015-03-18 15:32:04,Tech is a double-edged sword. Are we in danger of creating a future we will hate? What do you think? #TED2015
578016755232079872,2015-03-18 02:15:08,RT @annepasternak: I am reminded @ #TED2015 that humans can be beautiful and achieve wondrous things. Tx you #TED
578011744158658561,2015-03-18 01:55:13,"RT @lzixxaa: ""... Now I walk in love and I live that way every day"" Beautiful, just beautiful #TED2015 This is incredible @StoryCorps"
578011681554444288,2015-03-18 01:54:58,"RT @SandraOldfield: I just downloaded @Storycorps app after watching #TED2015…and now, oh, the possibilities are endless"
578011607847964673,2015-03-18 01:54:40,RT @drldsza: The #StoryCorps app is going to change lives. This is BIG #Ted2015
578008193537847297,2015-03-18 01:41:06,Check out the new @StoryCorps app for @daveisay's @TEDPrize. Who will you interview? http://t.co/LXPnG0SXH8 #TED2015
578007075856470016,2015-03-18 01:36:40,RT @LStorm: thrilled to be listening in on #TED2015 online ... a true gift. thank you to @TEDchris and the whole team #grateful
578003229650378752,2015-03-18 01:21:23,Delighted to award @daveisay the 2015 @TEDPrize! One of our most powerful wishes yet -- storytelling is at our core. #TED2015
577999256054808577,2015-03-18 01:05:36,"Such a warm, smart talk from Dame Stephanie Shirley, a true pioneer of women in tech. Inspiration for all of us. #TED2015"
577997478466854912,2015-03-18 00:58:32,RT @GabrielJR: Really thoughtful conversation between @TEDchris and Martine Rothblatt about her transition and self-expression of gender. #…
577994363772399616,2015-03-18 00:46:09,"RT @SuenJonathan: Dame Stephanie ""Steve"" Shirley isn't even done yet, and I'm already enamored by her charm and story! #TED2015 #glassceili…"
577990919338766336,2015-03-18 00:32:28,"RT @kaysarahsera: Oh, @AnandWrites. You just brought me (&amp; everyone around me) to tears. That was incredible. Thank you. Phenomenal."
577990565880586241,2015-03-18 00:31:04,"RT @Diggiada: I think I've found my favourite talk of the day, @AnandWrites was honestly incredibly moving #TED2015 #TEDActive2015"
577983592845938690,2015-03-18 00:03:21,"Invited @AnandWrites to speak after reading his book, The True American. Powerful story of two Americas. #TED2015"
577982832779386880,2015-03-18 00:00:20,The free livestream of session 5 starts now! One of my favorites at #TED2015. Really powerful life stories: http://t.co/P1fh5E5HGz
577978617696632832,2015-03-17 23:43:35,RT @Mattwkane: Forget the stock market - how about surgeons wearing the @davideagleman vest? #TEDActive #TED2015
577966027604144128,2015-03-17 22:53:33,"Stephen Petranek says humanity will become a multi-planetary species, thousands emigrating to Mars by mid century! Will you join? #TED2015"
577953399049580545,2015-03-17 22:03:22,RT @lucyblair: Mind officially blown as Alan Eustace talks about and shows video of his freefall from the Stratosphere in just a space suit…
577951004261498880,2015-03-17 21:53:51,Still amazed by the Rosetta landing -- astounding science. Can't wait for you to hear what @redplanet00 has learned. #TED2015
577929469316370433,2015-03-17 20:28:17,"RT @libbydoodle: Hey #TED2015 #TEDActive the ""rate this talk"" section of the notebook needs a ""mind=blown"" category after these sessions! W…"
577916969564946432,2015-03-17 19:38:37,"Nick Bostrom says superintelligence could be humanity's last invention, for better or (chillingly) worse. Time to get wise on this. #TED2015"
